博主,id,时间,来源,收藏,转发,评论,点赞,艾特,标签,内容
有钱大哥哥的老婆,5659692870.0,04月14日 22:48,OPPO Reno5 5G,,,,,,#赵立坚说请日本官员先喝核废水#,从去年疫情到现在的核废水，活的好艰难啊 ​
H你好阿i,7582452653.0,04月14日 22:48,OPPO Reno2 Z,,,,,,#学科大挑战##冲刺吧高考生# ​​​#日本副首相称喝处理核废水没事#高考学渣#高考倒计时#,日本核废水将排入大海，涵盖了哪些高考知识点？这篇文章帮你整理好了，高考生建议收藏慢慢看！ ​
Meow呜喵呜酱,3548369031.0,04月14日 22:48,iPhone,,,,,,#王志文力挺任豪#,这些太君们能不能赶紧去用核废水洗洗脑子啊？？？ ​
为什么用户名被人抢了2,7129986262.0,04月14日 17:51,iPhone 8 Plus,,,,,,-,这，这，这是什么意思？ ​
安顺市广播电视台,5613339033.0,04月14日 22:48,微博云剪,,,,,,#赵立坚说太平洋不是日本的下水道#【外交部：海洋不是日本的垃圾桶，太平洋也不是日本的下水道！】#日本核废水入海对中国有何影响#, 今天（14日）下午，在外交部举行的例行记者会上，有记者就日本政府决定以海洋排放方式处置福岛核电站事故核废水所引发的国际反应向发言人赵立坚提问。  赵立坚回应称，日本媒体称，日方排海工作预计两年后开始，将持续30年，拟排放核废水超过100万吨，排放数量之大，持续时间之长、涉及地域之广、风险等级之高前所未有。这里我想提出三个问题，希望日方回答。第一，日方真的听到了国内外的质疑和担忧吗？日本执政党一些议员表示，核废水应长期储存而非一排了之，现在做决定欠缺考虑。日本渔业协会发表抗议声明称，政府决定将给日本渔业带来沉重打击，绝对无法接受。昨天日本东京福岛等多地发生抗议游行，当地民众打出“海洋在哭泣，鱼类在哭泣，地球在哭泣”等标语。除了中国、韩国、俄罗斯、欧盟以外，311个环保团体向日方表示坚决反对。绿色和平组织、日本办公室气候与能源项目主任称，尽管日本有技术、有条件建造更多储存罐，却选择把核废水倾入太平洋。日方决定无视生态环境，完全是不正义的。第二，日方此举真的符合国际法吗？日方决定将开创严重核事故处理后废水向海洋排放的先例。日本是《联合国海洋法公约》缔约国，应当知道公约有关规定。根据公约，各国应采取一切必要措施，确保在其管辖或控制范围内的事件或活动所造成的污染，不致扩大到行使主权权利的区域之外。但由于洋流、量级、回游鱼类等因素，日本核废水排海将不可避免地造成跨境影响。根据《联合国海洋法公约》《及早通报核事故公约》《核安全公约》等，日本还需承担通知并充分协商环评监测、采取预防措施确保危险最小化、保障信息透明等国际义务，日方承担这些义务了吗？有人说，日方作出决定征得了美方的许可；我要强调的是，美国的许可不等于国际社会的许可，美国居然还对日方表示了感谢。既然美方重视环境问题，就应该切实负起责任，从维护海洋环境和人类健康安全出发，敦促日方以诚实、科学、负责任的态度，慎重对待福岛核电站事故核废水处置问题，而不是不分是非，不讲原则，采取双重标准。第三，日方拟排放的核废水真的符合国际标准吗？国际原子能机构专家组评估报告明确指出，福岛核电站现有经过处理的含氚废水中仍含有其他放射性核素。据东京电力公司统计，核废水中共含有62种放射性核素。2018年8月，环保人士经过分析东京电力公司发布的数据发现，处理后的核废水远远不止残留氚。其中，2017年度的核废水中有60次碘129严重超标，核废水中还存在锶90严重超标的问题。据媒体报道，加拿大已经在其西海岸的三文鱼身上检测到放射性元素。在美国夏威夷海域，放射物含量的水平已经达到先前的两倍。有关迹象都表明，日本福岛核污染可能已经扩散到北美地区。赵立坚强调：“海洋不是日本的垃圾桶，太平洋也不是日本的下水道！日方处理核废水，不应让全世界买单。”至于你提到的日本个别官员称这些水喝了也没事，请他喝了再说。日本水俣病殷鉴不远，当地受害民众的伤痛还未抚平。日方不应忘却历史悲剧，更不应揣着明白装糊涂。我们强烈敦促日方认清自身责任，秉持科学态度，履行国际义务，对国际社会、周边国家以及本国国民的严重关切作出应有回应。日方应重新审视福岛核电站核废水处置问题，在同各利益攸关国家和国际原子能机构充分协商并达成一致之前，不得擅自启动排海。中方保留进一步作出反应的权利。 ​ L海客新闻的秒拍视频 收起全文d
刹那永恒0121,6414963217.0,04月14日 22:48,iPhone客户端,,,,,,#赵立坚说请日本官员先喝核废水#,人家确实已经喝了啊，瞧这发言，无懈可击…… ​
叫铁甲小宝吧显得勇猛一点,2738020653.0,04月14日 17:19,微博视频号,,,,,,#赵立坚说请日本官员先喝核废水#】#日本副首相称喝处理核废水没事#,【，赵立坚：那请他喝了再说！ L央视新闻的微博视频 ​
大公報-大公網,1895431523.0,04月14日 19:50,微博 weibo.com,,9.0,1.0,9.0,,#日本核废水# #日本副首相称喝处理核废水没事#,两年后的微博热搜预定：太平洋怪谈（一字不差）O因為日本，「我」變成了一隻怪物  O因为日本，“我”变成了一只怪物 ​
子墨小叶,6654130701.0,04月14日 22:48,微博搜索,,,,,,#赵立坚说请日本官员先喝核废水#,是的 ​
月光铁十字,1660705135.0,04月14日 22:48,nova5Pro人像超级夜景,,,,,,#日本政府正式决定福岛核废水排海#, 电车问题升级版“你”快要渴死了，这时在你面前只有一瓶恒河水和一瓶福岛水，“你”会怎么选择？ ​
每天计划督促自己,6180980615.0,04月14日 20:06,iPhone 12,,,,,,-,【投稿】这咋就厌女又厌男了 ​
恬醉_,5529279440.0,04月14日 22:48,熬夜是小狗Android,,,5.0,0.0,,#王志文力挺任豪#,脑子不清醒的圣母批就应该闭上嘴啊 凭什么张嘴就慷中国人之慨去援助啊让中国人去之前不如这两位有识之士身先士卒一天两升核废水下肚生物过滤一下再排到太平洋发挥一下人道主义光辉吧，很难吗？ ​
欢欢Liu0620,2429167384.0,04月14日 22:48,iPhone客户端,,,,,,#日本副首相说核废水处理后能喝#,既然能喝，你们还往海里排个🔨？自己内部喝了还能解决饮用水资源问题 ​
华山怪侠03,5505942589.0,04月14日 22:09,微博 weibo.com,,,,,,-,"从2011年福岛核泄漏事件开始，美国食品和药物管理局FDA就和日本政府协商对相关地区进口食品发布进口警告⚠️ 《日本产品因放射性核污染未经检查而被扣 Detention Without Physical Examination of Products from Japan Due to Radionuclide Contamination》最新公告指示：各部门不经检查，就可以扣留来自Fukushima, Aomori, Chiba, Gumna, Ibaraki, Iwate, Miyagi, Nagano, Niigata, Saitama Shizuoka, Tochigi, Yamagata and Yamanashi 这些地区公司的食品。进口警告范围根据日方信息及双方协商逐步缩小。公告称，FDA和日本政府将继续合作，以确保受灾地区的产品不会对美国消费者构成健康风险。 FDA将继续监测由于放射性核污染引起的公共健康风险。FDA在4月12号发布了最新公告：O网页链接FDA在3月4号发布也曾更新公告：公告原文及食品清单链接：O网页链接 收起全文d"
而我们都不必多说,6827170648.0,04月14日 18:32,iPhone客户端,,,,,,-,下届日本首相选举没任豪我第一个不服气 ​
爱学习的穆云,6573253951.0,04月14日 22:48,nova 5i Pro,,,,,,#日本核废水入海对中国有何影响##和我们有什么关系#, 如果我在此环境中不能得到理解，我会保持缄默，但这并不代表着我不关心，我不再发言，因为在此我无法出声，而非我麻木。不要问丧钟为谁而鸣，它就为你而鸣。 ​
sr努力,6206501909.0,04月14日 22:01,微博 weibo.com,,,,,,#王志文力挺任豪#,前营人王志文力挺任豪，还表示是出于好意的话语，之后又删掉了微博 ​
岁岁子念,6087630119.0,04月14日 17:19,微博视频号,,,,,,#赵立坚说请日本官员先喝核废水#】#日本副首相称喝处理核废水没事#,【，赵立坚：那请他喝了再说！ L央视新闻的微博视频 ​
亓璞,5812897203.0,04月14日 22:48,nova 5z,,,,2.0,,#赵立坚说请日本官员先喝核废水#,可以直接打么，这种恶心的国家为什么要存在 ​
不管温饱的老蒯,6084261507.0,04月14日 18:12,华为手机 畅享玩不停,,,,,,-,任豪针对日本福岛核废水的发言，希望中国帮忙。这是在干什么？？？ ​
程一鸣家的纯粹,6716780217.0,04月14日 22:48,HUAWEI P40 Pro 5G,,,,,,#赵立坚说请日本官员先喝核废水#,请日本首相先喝！ ​
安庆新闻网微博,3513859023.0,04月14日 22:48,360安全浏览器,,,,,,-,新闻1+1丨日本核废水入海，“核”试吗？合适吗？O新闻1+1丨日本核废水入海，“核”试吗？合适吗？ ​
看我菜姬carry全场,6871339227.0,04月14日 22:48,iPhone客户端,,,,2.0,,#王志文力挺任豪##任豪回应#, 这两人脑子里装的是核废水吗但凡读过点书都不会说出这么智障的言论 ​​​
种花家的蓝领兔,5528324631.0,04月14日 11:23,新版微博 weibo.com,,,,1.0,,#日本副首相称喝处理核废水没事##如何看待日本福岛核废水排海#,吉林一号卫星于2021年04月08日拍摄的福岛第一核电站卫星影像，长光卫星遥感工程师通过AI算法，识别到厂区存在42种不同直径和高度的储存罐，累计总数量为1182个，可累计存储体积为1780397.809立方米，可累计存贮重量大约178万吨。 ​
霖儿athena,2546966304.0,2020年11月07日 13:59,微博视频号,,,,,,#日本东电工作人员称核废水稀释后能喝#,【日媒：】日本拟将福岛核污水排放入海在日本国内也引发强烈反对。据日媒报道，日本首相菅义伟9月26日在视察福岛第一核电站时，曾向工作人员询问，处理后的核废水能否饮用。核电站工作人员回应称，如果稀释的话就可以喝，但菅义伟最后并未饮用。L央视网快看的微博视频 收起全文d
万里松声入耳,7316228937.0,04月14日 22:48,realme X2 6400万鹰眼,,,,,,#任豪回应#, 无语，道德绑架到国家了，还很自豪。听说这个发言已经被搬到日网了，那么“善良”的话，你直接退出娱乐圈，现在学还来得及，入日本籍给他们处理核废水去吧。 ​
喂瞌睡鱼,3282693491.0,04月14日 22:48,Android,,,,,,#任豪回应#,我的天哪。能不能把这帮支持日本排放核废水的家伙打包扔到福岛去。支持排放的自己去喝稀释的废水，支持罩子的自己去建罩子。这样，一满足了这帮站在道德制高点的“国际主义精神”，成全他们当英雄。二稍微解决了一点废水，虽然少，但聊胜于无。三国家满足了部分国民的个人需求。四，反对者们耳根子也能清净清净。皆大欢喜 收起全文d
阿游不在,7327585093.0,04月14日 22:48,iPhone 8 Plus,,,,,,#任豪#,建议率先喝完核废水再来商议 ​
海外阿Q,2675602984.0,04月14日 22:48,HUAWEI Mate 20 Pro,,,2.0,6.0,,#赵立坚说请日本官员先喝核废水##日本副首相称喝处理核废水没事#,，大郎（麻生太郎），早点把药（核废水）喝了 ​
寸头小猫咪,5842638378.0,04月14日 18:45,麦芒 9 5G,,1.0,,,,#任豪呼吁大家一起守护地球#,守护地球，更加无条件支持祖国的每一个决定🇨🇳 ​
用户玺玺i,7337054145.0,04月14日 17:19,微博视频号,,,,,,#赵立坚说请日本官员先喝核废水#】#日本副首相称喝处理核废水没事#,【，赵立坚：那请他喝了再说！ L央视新闻的微博视频 ​
一颗快乐的小白菜er,7502724684.0,04月14日 22:47,Android,,,,,,#任豪回应#,光说不做假把式，去日本把那核废水给喝了，那你这才是真爱地球！ ​
小宋yaya,7553372230.0,04月14日 22:47,iPad mini,,,,,,#王志文力挺任豪#,多读书吧，多读书吧，多读书吧。这难道就是喝核废水cp？建议直接去医院，没个十年脑血栓干不出来这样的事。学学说话吧求求 ​
石喔噢喔噢,7200086441.0,04月14日 22:47,Android,,,,,,#任豪回应#,都tm在阻止日本倒核废水你却在“倒吧倒吧，中国会给你处理的”?????????????你哪来的脸?嗯? ​
一定要去见俊俊一次,7424705055.0,04月14日 22:47,真我V3 5G,,,,,,#赵立坚说请日本官员先喝核废水#,多喝点 ​
迷失者山风,3806879290.0,04月14日 22:47,哔哩哔哩,,,1.0,,,#哔哩哔哩动画#,日本政府决定福岛核废水直接排入大海！断子绝孙，祸害全人类、福岛核事故的来龙去脉 O日本政府决定福岛核废水直接排入大海！断子绝孙，祸害全人类、福岛核事故的来龙去脉 ​
星夜寻梦旅,7297132169.0,04月14日 22:47,❄️✨ Android,,,,1.0,,#赵立坚说请日本官员先喝核废水#,既然你觉得可以喝那能多喝点吗？喝的越多才能真正证明没有任何事情呦 ​
趣儿虫,3305518605.0,04月14日 22:47,微博国际版,,,,5.0,,#赵立坚说请日本官员先喝核废水#  中国有部分蛆可能也愿意去尝尝味道，不过那些蛆喝了就别回来了，谁知道会不会变异成什么了不得的大蛆。（ps：能乱绑架国家的，你先绑绑自己吧；pps：蛆，对不起，我知道我辱蛆了）#任豪回应#, ​
在殷府被你烧掉的纸元宝,6924611346.0,04月14日 18:54,拯救者电竞手机Pro,,,,,,-,抱歉，此微博已被作者删除。查看帮助：O网页链接
哦呼仙人,5136457420.0,04月14日 17:19,微博视频号,,,,,,#赵立坚说请日本官员先喝核废水#】#日本副首相称喝处理核废水没事#,【，赵立坚：那请他喝了再说！ L央视新闻的微博视频 ​
瑞萧裕,5898343787.0,04月14日 22:47,荣耀30 5G,,,,,,#赵立坚说请日本官员先喝核废水#,支持咱的外交发言人的话那就请日本首相先示范吧 ​
用户信小呆锦鲤Oooo,6507956694.0,04月14日 09:50,微博视频号,,,,,,#V光计划#,【逸语道破：核废水入海危及全球，还有人给日本政府做“文宣”？】日本政府想省事，东电想省钱，但即便日本政府对国际原子能机构影响巨大，他们也根本没有为日本政府开通行证。我们国内的部分自媒体哪里来的自信给日本政府“开绿灯”？说日本核废水安全的“公关稿”请不要再发了。 L沈逸的微博视频 收起全文d
bx-Mas-Venus,6607144603.0,04月14日 17:19,微博视频号,,,,,,#赵立坚说请日本官员先喝核废水#】#日本副首相称喝处理核废水没事#,【，赵立坚：那请他喝了再说！ L央视新闻的微博视频 ​
瑾肴,6570440245.0,04月14日 22:47,林楠笙老婆Android,,,,,,#赵立坚说请日本官员先喝核废水#,日本官员指定脑子有问题 ​
平头不卷浮,6306443529.0,04月14日 22:47,OnePlus 7 Pro,,,,,,-,日本人这么会玩，一人一点核废水喝掉不行么 ​
真不靠谱啊BJ,3179248003.0,04月14日 22:47,微博问答,,,,,@陶短房,-,我围观了@陶短房 的回答，该问题价值29.99元，围观仅1元，快来一起围观~ O微博问答 ​
exo---perfume,3206441874.0,04月14日 22:47,真我V5 闪充奥利给,,,1.0,0.0,,#王志文力挺任豪#,建议让日本政府官员和任豪王志文还有精日分子一起喝“无污染喝了没有问题的”核废水。 ​
喜欢吃鸡腿呀,7186406142.0,04月14日 22:47,nova4自拍极点全面屏,,,,,,#赵立坚说请日本官员先喝核废水#,喝！！！给我喝大杯的！！！艹！！小日本什么时候亡国啊 ​
隐身piu-,2129558673.0,04月14日 22:01,微博 weibo.com,,,,,,#王志文力挺任豪#,前营人王志文力挺任豪，还表示是出于好意的话语，之后又删掉了微博 ​
封璟公子,7344898062.0,04月14日 22:47,荣耀20i,,,,,,#任豪回应#好家伙…这大哥怎么回事？？？#赵立坚说请日本官员先喝核废水#, 跟国家对着干也是离谱…我当初怎么就一时眼拙给他投了票了呢………回去把九年义务教育学好再吱声吧… ​
火星郎念,6327194858.0,04月14日 17:11,微博视频号,,,,,,#赵立坚请日本个别官员喝了核废水再说#,【】今天，赵立坚强调：“海洋不是日本的垃圾桶，太平洋也不是日本的下水道！日方处理核废水，不应让全世界买单。”至于你提到的日本个别官员称这些水喝了也没事，请他喝了再说。（央视） L共青团中央的微博视频 ​​​
嫖尽天下美男纸,5181412418.0,04月14日 22:47,iPad客户端,,,2.0,2.0,,#日本核废水入海对中国有何影响#, 日本人变异变成进击的巨人，统治者为了保护他们建立起围墙。。。 ​
安顺市广播电视台,5613339033.0,04月14日 22:47,微博云剪,,1.0,,2.0,,#日本副首相称喝处理核废水没事#,【 日本网友：你先喝】日本政府正式决定将福岛核废水排放入海，针对日本副首相兼财务大臣麻生太郎称“处理过的核废水喝了也没什么问题”，有日本网友愤怒发帖：“如果你真的这么想的话，那你先喝吧！”有网友指出，“东京电力公司说没地放储水罐的理由是骗人的，他们只是不想为一个没用的核电站再花钱了吧！” ​ L央视新闻的微博视频 收起全文d
李小萱萱萱萱萱,5115994274.0,04月14日 22:47,HUAWEI P40 Pro 5G,,,,,,#赵立坚说请日本官员先喝核废水#,说的好，让他们把核废水喝光再说！ ​
大吴-所谓,6071311533.0,04月14日 22:47,vivo NEX AI智慧旗舰,,,1.0,3.0,,#日本为何执意排核污入海#,觉得虚张声势地说要排放核废水，然后让其他国家来出钱出力，减少自己的负担，毕竟自己排出来，自己遭殃，还是一个靠海的国家。自己毒自己？ 2深圳 ​
路漫慢蔓漫其修远兮,7183779531.0,04月14日 20:16,微博视频号,,,,,,#央视曝李亨利的汉奸行径#】#李亨利#，原名李沪祥，生于上海，利用改革开放的机遇攫取了第一桶金。他却说，只要是对中国不利的事情，他都会不遗余力地支持。他贷款510万支持反中乱港，在充裕资金的操作下，香港反对派代表团得以与某西方大国高级官员直接见面。他甚至帮助某西方大国，炮制了对我们更为恶毒的制裁条款。 今年4月2日，李亨利因资助危害国家安全犯罪活动罪被判处有期徒刑11年！#国家安全教育日#,【 L央视新闻的微博视频 收起全文d
言叶今远,2237375372.0,04月14日 22:47,Android,,,,,,#赵立坚说请日本官员先喝核废水#,日本 大病 您先请喝 别把别人当傻子 ​
微笑着安静只因漠然,2716046484.0,04月14日 22:47,OPPO A11,,,2.0,5.0,,#任豪回应#,我也有看到日本决定排放核废水是想逼着邻国帮忙处理核废水这样的言论。如果只是普通人，说了便罢顶多被怼几句，但是明星的一言一行很容易被放大N倍，所以公共平台艺人还是少讨论一些政事吧 ​
突然来了酒山妖,3038027122.0,04月14日 09:50,微博视频号,,,,,,#V光计划#,【逸语道破：核废水入海危及全球，还有人给日本政府做“文宣”？】日本政府想省事，东电想省钱，但即便日本政府对国际原子能机构影响巨大，他们也根本没有为日本政府开通行证。我们国内的部分自媒体哪里来的自信给日本政府“开绿灯”？说日本核废水安全的“公关稿”请不要再发了。 L沈逸的微博视频 收起全文d
医学美容菁英论坛,6072853834.0,04月14日 22:19,钱辉_医学美容超话,,,,,,#日本副首相称喝处理核废水没事##赵立坚说太平洋不是日本的下水道# 针对日本政府正式决定以海洋排放方式处置福岛核电站事故核废水，14日，外交部发言人赵立坚三连问斥责日方：①日方真的听到了国内外的质疑和担忧吗？#311个环保团体向日方表示坚决反对#,②日方此举真的符合国际法吗？日方决定将开创严重核事故处理后废水向海洋排放的先例。③日方拟排放的核废水真的符合国际标准吗？据东京电力公司统计，核废水中共含有62种放射性核素。赵立坚强调：“海洋不是日本的垃圾桶，太平洋也不是日本的下水道！日方处理核废水，不应让全世界买单。”至于你提到的日本个别官员称“这些水喝了也没事”，那请他喝了再说。 L钱辉_医学美容的微博视频 收起全文d
D-T啊,6660707664.0,04月14日 22:47,华为手机 畅享玩不停,,,,,,#赵立坚说请日本官员先喝核废水#,哈哈哈哈哈哈哈，外交部可以啊哈哈哈哈哈哈哈 ​
李天诗,2039584065.0,04月14日 09:50,微博视频号,,,,,,#V光计划#,【逸语道破：核废水入海危及全球，还有人给日本政府做“文宣”？】日本政府想省事，东电想省钱，但即便日本政府对国际原子能机构影响巨大，他们也根本没有为日本政府开通行证。我们国内的部分自媒体哪里来的自信给日本政府“开绿灯”？说日本核废水安全的“公关稿”请不要再发了。 L沈逸的微博视频 收起全文d
猫眸子,5899500237.0,04月14日 22:47,iQOO U3 性能小金刚,,,,5.0,,-,白天工作都要累死了，晚上回家还得为日本排核废水担惊受怕，菅义伟，你拿什么还我 ​
想多陪你几年,5178192856.0,04月14日 22:47,微博搜索,,2.0,1.0,1.0,,#日本大叔讲核废水排海危害##我们是地球生命共同体#,没有人是自成一体、与世隔绝的孤岛， 每一个人都是广袤大陆的一部份。 如果海浪冲掉了一块岩石， 欧洲就减少。 如同一个海岬失掉一角， 如同你的朋友或者你自己的领地失掉一块。每个人的死亡都是我的哀伤， 因为我是人类的一员。 所以，不要问丧钟为谁而鸣， 它就为你而鸣！ 收起全文d
太原新闻网官方微博,2346031615.0,04月14日 22:47,360安全浏览器,,,,,,-,反对一倒了之！一图看懂日本核废水排海危害O反对一倒了之！一图看懂日本核废水排海危害 ​
汉唐桥,5601505370.0,04月14日 22:47,HUAWEI Mate 30,,,1.0,1.0,,-,最近小日本非常的作，参与遏制中国发展、干涉中国内政、试图剥夺中国的钓鱼岛主权，如今干脆把福岛核废水污染世界海洋。我没别的评论，想想抗战中我们牺牲的两千多万同胞，就一句——我们欠日本一些核弹，看看什么时候送还给它。 ​
中天電視官方NEWS,1878156541.0,04月14日 22:47,微博 weibo.com,,4.0,0.0,0.0,,#麻生太郎# 宣称：“我们核废水的氚浓度，比中韩排放的和废水还低，喝了又不会有事”，引发邻国强烈担忧。对此，国民党台北市议员#游淑慧# 直言，这种自私自我的日本官僚，和70年前有什么不同？民进党也是一个骨头软的政党，只敢看人下菜碟，这批核废水才137万吨，日本怎不自己喝掉。#文在寅欲起诉日本核污水入海#,【日核废水将排入海害到台湾 游淑慧怒呛民进党】日本政府决定二年后要将福岛核废水排放入海，日本副首相 更多详情：O网页链接 收起全文d
Baidu_爱谁谁吧,7495139269.0,04月14日 22:47,iPhone XR,,,,1.0,,-,线下anti闲的没事干就跟着二鬼子一起把核废水全喝了 ​
渡边7屁屁,3100398673.0,04月14日 22:47,iiiiiiiiiPhone 11,,,6.0,2.0,,-,日常看日本的ニュースコメント想给日本人来一拳😅如果认为中国的水比核废水脏的话，请你们现在立刻把核废水喝完，啥b ​
Dear-鱼小丸,7541921171.0,04月14日 17:19,微博视频号,,,,,,#赵立坚说请日本官员先喝核废水#】#日本副首相称喝处理核废水没事#,【，赵立坚：那请他喝了再说！ L央视新闻的微博视频 ​
暖暖Raby,2011973207.0,04月14日 22:47,HUAWEI Mate30 Pro 5G,,,,,,#日本核废水入海对中国有何影响#, 哥斯拉真的要诞生了……喵了个咪……我最爱的海鲜……啊…… 2成都 ​
大姨妈不要痛,1171307974.0,04月14日 22:01,微博 weibo.com,,,,,,#王志文力挺任豪#,前营人王志文力挺任豪，还表示是出于好意的话语，之后又删掉了微博 ​
脑洞创作指南,2126472660.0,04月14日 22:47,iPhone客户端,,,,7.0,,#任豪回应#,今天刚被科普到切诺尔贝利核电站的历史，再看着他，这是人说的话吗，还是个公众人物？当初苏联这个核电站危机是用了牺牲了好几万人的血肉之躯才解决，日本明明有那么多解决方案，选择了最无耻的一种，竟然还有中国人觉得应该让中国去帮他解决？你难道认为日本它是不知道怎么解决这个核废水问题吗？放p，它就是自私，害怕牺牲，损人不利己 收起全文d
