博主,id,时间,来源,收藏,转发,评论,点赞,艾特,标签,内容
2345落英缤纷,6628711225.0,04月12日 22:59,OPPO智能手机,,,,1.0,,#日本核废水可致癌致畸致突变#,联合国呢？这么大的事都不发声的吗？我天虽然我不是医学生，但是切尔诺贝利纪录片看得我毛骨悚然，这个事情怎么办？ ​
脸长也叫特长bai生,2962593974.0,04月12日 22:59,OPPO R9s,,,,,,#日本核废水可致癌致畸致突变#,"日本核废水一旦排入太平洋中危害有多大,以后海鲜还有人敢吃吗?“哥斯拉”会因此出现吗？ ￼moons正浓-的微博视频  ​"
小桃红柳绿,2149115373.0,04月12日 22:59,华为P8,,,,,,#日本核废水可致癌致畸致突变#,【专家：】4月9日，日本政府基本决定将福岛核污水排入大海。12日，日本首相菅义伟表示，解决东京电力公司福岛第一核电站中不断增加的核污水一事，已经是“不能推迟”的课题。郑州大学教授李顺义指出，核废水排入大海以后，首先会影响到周边国家，然后经过海洋的大洋环流， ​... 全文 收起全文d
苹果柠檬刮油汤,2635391551.0,04月12日 22:59,Android客户端,,,,,,#日本核废水可致癌致畸致突变#,今日日本首相菅义伟再次表示，福岛核污水排入大海已经不能推迟了德国的海洋科学研究机构的计算显示，从排放之日起，57天内放射性物质就将扩散至... 全文 ​
陳毅YiChen,2389546112.0,04月12日 22:59,小米5s 拍照黑科技,,,,,,#日本核废水可致癌致畸致突变#,【专家：】4月9日，日本政府基本决定将福岛核污水排入大海。12日，日本首相菅义伟表示，解决东京电力公司福岛第一核电站中不断增加的核污水一事，已经是“不能推迟”的课题。郑州大学教授李顺义指出，核废水排入大海以后，首先会影响到周边国家，然后经过海洋的大洋环流， ​... 全文 收起全文d
接招吧制作人,2662900871.0,04月12日 22:59,小米5s 拍照黑科技,,,,,,#日本核废水可致癌致畸致突变#,今日日本首相菅义伟再次表示，福岛核污水排入大海已经不能推迟了德国的海洋科学研究机构的计算显示，从排放之日起，57天内放射性物质就将扩散至... 全文 ​
美美喜欢,1355746895.0,04月12日 21:40,微博 weibo.com,,,,,,#v光计划#, 这是IAEA4月2日对日本福岛废水的评估报告，链接：O网页链接。图四是报告的摘要版，提到了主要的发现和建议：上面一段是所谓“同意”的来源，就是在技术原理上的同意；下一段是实践层面，IAEA既没有权限也没有兴趣直接给日本政府背书，大致机翻见图六，关键词是所有利益相关者 ​
黎明冲冲冲,2607018865.0,04月12日 22:59,前置双摄vivo X9,,,,,,#日本核废水可致癌致畸致突变#,"日本核废水一旦排入太平洋中危害有多大,以后海鲜还有人敢吃吗?“哥斯拉”会因此出现吗？ ￼moons正浓-的微博视频  ​"
Je_Romaric,2720307890.0,04月12日 20:09,微博 weibo.com,,,,,,#日本核废水可致癌致畸致突变#影视作品中，日本人总是在反思对自然的破坏。影视作品外，“我们决定往海里排核废水啦，污染到你们真是不好意思啦”。奥特曼也许是虚构的，但怪兽却是真实存在的，就在这些人的心里。#暴走君聊天室#, ​
Kyra老安,6418144367.0,04月12日 22:59,iPhone客户端,,,1.0,1.0,,-,世界为什么变得这么烂甚至都不敢想前几年能第一排、hk五月之约、台湾跨年成就全达成吃顿饭一拍脑袋隔月就去趟霓虹以为上班了世界就能越来越大 结果出南京都要左申请右报批一边想去环球影城任天堂区一边又恨死霓虹核废水乱排全地球一起跟着倒霉了不过想想全人类毁灭就在一瞬间 反而生活没烦恼了 ​
liuyue65_,7522735495.0,04月12日 15:23,微博 weibo.com,,,,,,#日方不能对国际社会的反对视而不见#】#外交部回应日本拟决定核废水排海#,【外交部：：目前国际舆论对日方拟决定核废水排海高度关注，普遍表示质疑和反对。日本国内也有不少强烈反对意见。日方经常要求他国履行国际责任，现在国际社会都在看着日方，日方不能视而不见、听而不闻。此事关系重大，日方应对国际公共利益负责，这也是对本国民众利益负责。为维护国际公共利益和中国人民健康安全，中方已通过外交渠道向日方表明严重关切，要求日方切实以负责任的态度，审慎对待福岛核电站核废水处置问题。（总台央视记者张雪松）O网页链接 收起全文d
猫酱_凛遥桔梗本命,5870129478.0,04月12日 22:58,网路恶霸猫Android,,,,,,-,本猫真滴好奇日本民众对核废水排到太平洋的态度肯定反对吧海鲜爱好国 这以后咋吃 45万民众联名反对但好多就体谅态度 ​
赵鹏飞,1857345450.0,04月12日 22:58,iPhone 8 Plus,,1.0,6.0,9.0,,#菅义伟回应福岛核污水排入大海#,作为发达国家，日本并不缺乏资金和技术手段，来应对这类突发应急事件，福岛核废水之所以拖了10年还悬而未解、越拖越严重，主要还是日本社会的组织体系出了大问题。政府、党派、商界、财阀，乃至媒体、宗教等方方面面分散了全社会的决策权力。在常态化的时候，纵横交织的权力保证了社会的稳固，也培育出了国民礼仪周全情绪压抑的矛盾性格。显而易见的弊端就在于非常态化时，决策的拖沓和温吞。与此同时，资本的逐利性随处可见。福岛核废水处理选择成本最低的排放大海是一例，医疗技术超前国内新冠疫苗研发却空前滞后，又是一个显著的例子。 收起全文d
乱尘苍苔,6426456710.0,04月12日 06:06,微博发布平台专业版,,,,,,#日本研究抑制牛打嗝#,【为减少碳排放 】据日本时事通讯社11日报道，该国农林水产领域排放的约为5000万吨温室气体中，牛打嗝和排泄物所释放的温室气体约为1370万吨，约占总数三成。日本农林水产省为此准备进行相关研究，以促使牛减少温室气体排放。据悉，牛胃分解饲料时会在微生物的作用下产生甲烷，并通过打嗝释放出来。而甲烷产生的温室效应是二氧化碳的25倍，进而导致全球变暖。由于甲烷的产生与牛胃中的微生物有关，所以日本农林水产省计划在今年进行相关实证研究，将甲烷排放较少的牛个体与其他牛进行比较，分析其诱发原因。（环球网） 收起全文d
狱炎猛火,7510742365.0,04月12日 18:40,帝吧超话,,,,,,#外交部回应日本拟决定核废水排海# #日方不能对国际社会的反对视而不见#,赵立坚：日本福岛发生的核事故是迄今为止全球发生的最为严重的核事故之一。目前国际舆论对日方拟决定核废水排海高度关注，普遍表示质疑和反对。日本国内也有不少强烈反对意见。日方经常要求他国履行国际责任，现在国际社会都在看着日方，日方不能视而不见、听而不闻。此事关系重大，日方应对国际公共利益负责，这也是对本国民众利益负责。为维护国际公共利益和中国人民健康安全，中方已通过外交渠道向日方表明严重关切，要求日方切实以负责任的态度，审慎对待福岛核电站核废水处置问题。 收起全文d
一个院长的思考,3187525994.0,04月11日 17:21,iPhone 8 Plus,,9.0,4.0,9.0,,-,自然生态系统提供至关重要的资源，例如食物、水、燃料、植物授粉、药物、防范风暴和洪水的保护，以及使生命成为可能的基本服务。我们正在努力保护地球的自然美并为子孙后代提供经济惠益。 ​
天真橘可爱,1944234933.0,04月12日 22:58,iPhone客户端,,,,,,-,等等核废水是明天？？ ​
地攥攥儿,6708399621.0,04月11日 17:44,荣耀30 Pro 5G,,,,,,#只有10%被蜱虫叮咬的人会发病#,10%发病率其实不算低，十个人中就有一个人会发病。被蜱虫叮咬后人会在24~48小时出现不同的炎症反应，甚至某些蜱还会注入麻痹神经的毒素，使人神经中枢受侵而死亡（儿童较多，国外报道较多）。所以遇到蜱虫千万不能拍或者拔，因为强行扯出会让它的吸血管（假头）断在皮肤内。那碰到这种情况我们应该如何处理？1. 事先预防蜱虫。可以选择喷洒杀虫剂，保持住房通风干燥；个人进入林区或野外时穿着长袖长裤，扎紧腰带、袖口、裤腿，颈部系上毛巾，结束后需检查身体是否有异物附着。2. 如果被蜱虫叮咬了，可用乙醚、氯仿涂抹在虫体头部，或者在旁边点燃蚊香使其松口；也可以用凡士林厚涂在虫体头部使其窒息，再用镊子轻轻拉出。假如其口器残留在皮肤内则需要手术取出。3. 事后及时消毒并做封闭处理，有全身中毒症状需要使用抗组胺药或糖皮质激素，出现麻痹或者发热头疼等情况则需要及时抢救。 收起全文d
金仔79089,6064866680.0,04月12日 22:57,学习强国客户端,,,,,,-,日本拟决定核废水排海 外交部：中方已表明严重关切 O网页链接 ​
就在郑州,5776961752.0,04月12日 16:06,微博视频号,,,,,,#日本核废水可致癌致畸致突变#】4月9日，日本政府基本决定将福岛核污水排入大海。12日，日本首相菅义伟表示，解决东京电力公司福岛第一核电站中不断增加的核污水一事，已经是“不能推迟”的课题。郑州大学教授李顺义指出，核废水排入大海以后，首先会影响到周边国家，然后经过海洋的大洋环流，十年以后，整个太平洋将会受到全部的污染。它如果存在人的体内，就可能导致“三致”，致癌致畸致突变，对人的遗传基因有重大的影响。#日本称处理福岛核污水不能推迟# #外交部回应日本拟决定核废水排海#,【专家： L大参考的微博视频 收起全文d
ALEX神州老虎不吃面,3831966674.0,04月12日 20:15,微博视频号,,,,,,#日本政府基本决定将福岛核污水排入大海# 日本明天将要决定，将福岛核污水排入大海。日本说，“福岛核污水将会达标后再排入大海”。为什么这种说法不可信？东京电力公司是管理运营福岛核电站的公司，数数过去我采访过的东电，那些“篡改瞒报”，你信他们会让核污水达标吗？  L凤凰李淼的微博视频 #v光计划#, 收起全文d
江南之嘉,2144626862.0,04月12日 22:56,学习强国客户端,,,,,,-,日本拟决定核废水排海 外交部：中方已表明严重关切 O网页链接 ​
煜骑士,6822837932.0,04月12日 15:23,微博 weibo.com,,,,,,#日方不能对国际社会的反对视而不见#】#外交部回应日本拟决定核废水排海#,【外交部：：目前国际舆论对日方拟决定核废水排海高度关注，普遍表示质疑和反对。日本国内也有不少强烈反对意见。日方经常要求他国履行国际责任，现在国际社会都在看着日方，日方不能视而不见、听而不闻。此事关系重大，日方应对国际公共利益负责，这也是对本国民众利益负责。为维护国际公共利益和中国人民健康安全，中方已通过外交渠道向日方表明严重关切，要求日方切实以负责任的态度，审慎对待福岛核电站核废水处置问题。（总台央视记者张雪松）O网页链接 收起全文d
塔上五月的风·TMHer,7267492822.0,04月12日 22:56,iPhone客户端,,,1.0,,,-,非粉之后的无心人，给环保小达人纶的真经……开麦狙一下本子核废水的问题吧大陆绝对不会再有人骂你td了 真的，反正你是真的关注环保，这件事也真的属于世界范围地球存亡的问题啦看完黄姐的新闻评述 我被吓死人类💊 ​
-姝蝶-,1980457592.0,04月12日 12:35,微博视频号,,,1.0,2.0,,-,“海洋在哭泣、鱼类在哭泣、地球在哭泣……”日本福岛民众举行集会反对政府排核污水入海。L微丢的微博视频 ​​​
春秋剑气长,6446581909.0,04月12日 16:06,微博视频号,,,,,,#日本核废水可致癌致畸致突变#】4月9日，日本政府基本决定将福岛核污水排入大海。12日，日本首相菅义伟表示，解决东京电力公司福岛第一核电站中不断增加的核污水一事，已经是“不能推迟”的课题。郑州大学教授李顺义指出，核废水排入大海以后，首先会影响到周边国家，然后经过海洋的大洋环流，十年以后，整个太平洋将会受到全部的污染。它如果存在人的体内，就可能导致“三致”，致癌致畸致突变，对人的遗传基因有重大的影响。#日本称处理福岛核污水不能推迟# #外交部回应日本拟决定核废水排海#,【专家： L大参考的微博视频 收起全文d
上善若水丶神游太虚,5376993338.0,04月12日 22:55,学习强国客户端,,,,,,-,日本拟决定核废水排海 外交部：中方已表明严重关切 O网页链接 ​
营养不可缺少,3655831647.0,04月12日 06:06,微博发布平台专业版,,3.0,1.0,0.0,,#日本研究抑制牛打嗝#,【为减少碳排放 】据日本时事通讯社11日报道，该国农林水产领域排放的约为5000万吨温室气体中，牛打嗝和排泄物所释放的温室气体约为1370万吨，约占总数三成。日本农林水产省为此准备进行相关研究，以促使牛减少温室气体排放。据悉，牛胃分解饲料时会在微生物的作用下产生甲烷，并通过打嗝释放出来。而甲烷产生的温室效应是二氧化碳的25倍，进而导致全球变暖。由于甲烷的产生与牛胃中的微生物有关，所以日本农林水产省计划在今年进行相关实证研究，将甲烷排放较少的牛个体与其他牛进行比较，分析其诱发原因。（环球网） 收起全文d
贵州综合广播,2085931962.0,04月12日 22:55,Android,,,,1.0,,#日方不能对国际社会的反对视而不见#】#外交部回应日本拟决定核废水排海#,【外交部：：目前国际舆论对日方拟决定核废水排海高度关注，普遍表示质疑和反对。日本国内也有不少强烈反对意见。日方经常要求他国履行国际责任，现在国际社会都在看着日方，日方不能视而不见、听而不闻。此事关系重大，日方应对国际公共利益负责，这也是对本国民众利益负责。为维护国际公共利益和中国人民健康安全，中方已通过外交渠道向日方表明严重关切，要求日方切实以负责任的态度，审慎对待福岛核电站核废水处置问题。（总台央视记者张雪松）O网页链接 收起全文d
148102707dZEj,1972641277.0,04月12日 22:55,学习强国客户端,,,,,,-,日本拟决定核废水排海 外交部：中方已表明严重关切 O网页链接 ​
狱炎猛火,7510742365.0,04月12日 21:02,帝吧超话,,,,,,#核污水入海有多可怕##日本核废水可致癌致畸致突变#,日本近期发生多起大王乌贼搁浅事件，网友怀疑是福岛核废水排放造成的环境污染 ​
大公報-大公網,1895431523.0,04月12日 22:54,微博 weibo.com,,6.0,9.0,0.0,,#日本政府要求2年后能开始核废水排海# 【日本核污水真能“一倒了之”?　影响有多大?】“核事故处理后废水的处置没有先例，处置方式仍需进一步研究。”刘新华说，废水排放对海洋环境影响程度取决于所排放放射性核素的种类、浓度、总量，以及特定放射性核素与沉积物、海洋生物等海洋环境关键要素相互作用等情况。但福岛大量废水向太平洋排放后，必将导致放射性核素在排放点附近海域的海洋沉积物和海洋生物中富集，部分核素将随洋流等向其他海域迁移、扩散。 日本是我国的近邻，不论日本排放废水是采取近岸排放还是远洋公共海域排放，放射性核素都将随洋流在北太平洋海域扩散，我国管辖海域不可避免会受到放射性物质的跨界污染影响。O网页链接（大公文汇全媒体） #菅义伟回应福岛核污水排入大海# #日本政府正式决定福岛核废水排海#, 收起全文d
鎏金龅牙,7365242988.0,04月12日 21:40,微博 weibo.com,,,,,,#v光计划#, 这是IAEA4月2日对日本福岛废水的评估报告，链接：O网页链接。图四是报告的摘要版，提到了主要的发现和建议：上面一段是所谓“同意”的来源，就是在技术原理上的同意；下一段是实践层面，IAEA既没有权限也没有兴趣直接给日本政府背书，大致机翻见图六，关键词是所有利益相关者 ​
愿玲相随,1165442912.0,04月12日 22:54,iPhone客户端,,,,,,-,日本拟决定核废水排海 外交部：中方已表明严重关切 O网页链接 ​
拉不其尔诺,6595859084.0,04月10日 15:35,微博发布平台专业版,,,,,,#环保少女不满疫苗分配拒绝参加气候大会#,【抗疫环保两开花？ 】BBC当地时间10日报道，环保少女格里塔表示，由于全球疫苗分配不均，她不会参加11月的联合国气候大会。她称许多国家以牺牲其他高风险群体和一线工作者为代价，为“健康的年轻人”接种疫苗。“社会不平等和气候不公平已经是气候危机的核心问题。如果人们不能接种疫苗，不能平等地旅行，这是非常不民主的，会使问题恶化。”她呼吁解决疫情民族问题，用全球性方案结束疫情。 收起全文d
一只小妥妥,7343442049.0,04月12日 15:23,微博 weibo.com,,,,,,#日方不能对国际社会的反对视而不见#】#外交部回应日本拟决定核废水排海#,【外交部：：目前国际舆论对日方拟决定核废水排海高度关注，普遍表示质疑和反对。日本国内也有不少强烈反对意见。日方经常要求他国履行国际责任，现在国际社会都在看着日方，日方不能视而不见、听而不闻。此事关系重大，日方应对国际公共利益负责，这也是对本国民众利益负责。为维护国际公共利益和中国人民健康安全，中方已通过外交渠道向日方表明严重关切，要求日方切实以负责任的态度，审慎对待福岛核电站核废水处置问题。（总台央视记者张雪松）O网页链接 收起全文d
云过天天更蓝,7210155979.0,04月12日 09:33,微博视频号,,,,,,#v光计划#, 日本排放废水的简单模拟 L沈逸的微博视频 ​
不想睡的蚊子,2948573027.0,04月12日 22:54,iPhone客户端,,,1.0,,,-,明天日本要放核废水了 ​
真实的肥妈,6059985097.0,04月12日 21:40,微博 weibo.com,,,,,,#v光计划#, 这是IAEA4月2日对日本福岛废水的评估报告，链接：O网页链接。图四是报告的摘要版，提到了主要的发现和建议：上面一段是所谓“同意”的来源，就是在技术原理上的同意；下一段是实践层面，IAEA既没有权限也没有兴趣直接给日本政府背书，大致机翻见图六，关键词是所有利益相关者 ​
遂昌快活林,1908417784.0,04月12日 22:53,遂昌金矿iPhone 12 Pro Max,,,,3.0,,-,"天马科技    1    饲料    1.日本核污水排放，日本政府在4月9日宣布，将会向太平洋排放核废水，在4月13日将会正式批准这个决定。我国是水产品消耗大国，而且据联合国粮农组织预测，2020年中国人均海鲜消费量将达到约36公斤，这与2006年的数据相比，上涨了约38％。国内市场，很可能会因日本投放核污水，而被彻底打乱，内陆淡水养殖关注得到提高。2.饲料，专业从事特种水产配合饲料研发、生产和销售的国家级高新技术企业和农业产业化国家重点龙头企业,产品主要应用于鳗鲡、石斑鱼、大黄鱼、龟等特种水产动物;参与起草制定的大黄鱼配合饲料行业标准发布并获批准实施。3.主营业务，公司是一家专业从事特种水产配合饲料研发、生产、销售的高新技术企业。公司主要产品有：鳗鲡配合饲料、鳖配合饲料、鲟鱼配合饲料、大黄鱼配合饲料、金鲳配合饲料、石斑鱼配合饲料、种苗期配合饲料。 2丽水·凯恩・兴居花园 收起全文d"
vyrnjklq,6270548715.0,04月12日 16:08,360安全浏览器,,,,,,-,某松鼠会又开始活跃起来了 ​
白放翁,6391961651.0,04月12日 22:52,iPhone客户端,,,,,,-,按照日本政府估算，至少要排核废水30年。。。中国沿海30年不打鱼，要损失多少万亿？？？咋打鱼？？？水里都是核辐射，卖给谁？？？台湾更惨，现在已经缺水，未来三十年下的雨多数来自台湾四面的海洋，连续30年的带有核辐射的雨水，台湾以后癌症都是一般病症，不是百分比的算致癌率而是百分百的算致癌率，每生一个就是一个癌症患者。。。台湾现在就是一座孤岛。。。台湾人民要么回归到中国内地生活躲避这次灾难，要么远洋欧美成为难民。。。那些沿海国家更加悲惨，连续三十年出口的水果粮食带有核辐射，直接就经济倒退三十年，一群癌症患者。。。所以，必须缩短日本排核废水的年限。。。也就是说必须让日本引爆核反应堆。。。不然，太平洋沿海小国家很可能直接灭国。。。这次不是几十万难民，，，而是几亿难民。。。日本配得起吗？？？ 收起全文d
城星时间,7513854140.0,04月12日 22:52,荣耀20,,,,,,-,小日本的核废水排入大海估计是既定的事实了，已经没法储存和处理了，这个对海洋的伤害没法测出伤害海鲜还能吃吗 ​
版本错误正在升级,3814256704.0,04月12日 22:31,HUAWEI P40 Pro 5G,,,,,,#菅义伟回应福岛核污水排入大海#,日本人要吧核污水排进大海，估计只要是个人，都应该知道这对环境的破坏，奇怪的是，这时候没有一个“热衷”于环保的人站出来反对，平时那些所谓的环保人士，此刻都如同约定好了一般选择了沉默，它们究竟真的是关注环保吗？我想只有它们自己心里知道！ ​
热门时刻,5594711059.0,04月12日 22:52,iPhone客户端,,,,1.0,,#菅义伟回应福岛核污水排入大海#,核废水绝对不能倒入大海！简直就是自我灭绝行为！ L热门时刻的微博视频 ​
枯叶蝶的苏醒,3820844253.0,04月12日 22:52,微博 HTML5 版,,,1.0,,,-,看到进击巨人这么美化法西斯侵略历史为以前真情实感追过这个漫感到拧巴 甚至怀疑食尸鬼和鬼灭也有夹带右翼私货的可能 就像这两天看到的新闻一样拧巴 我们因为项目可能占用红树林闹到不可开交的时候人家已经准备往海里排核废水了 这么大工程不需要环评论证拍脑袋决策环保NGO不去抗议吗 真想一起陪zang？…… 收起全文d
伍长_你是最棒的王,1860074594.0,04月12日 20:09,HUAWEI P30 Pro,,,,,,#日本核废水可致癌致畸致突变#影视作品中，日本人总是在反思对自然的破坏。影视作品外，“我们决定往海里排核废水啦，污染到你们真是不好意思啦”。奥特曼也许是虚构的，但怪兽却是真实存在的，就在这些人的心里。#暴走君聊天室#, ​
white55开14640,6975628818.0,04月12日 22:52,学习强国客户端,,,,,,-,日本拟决定核废水排海 外交部：中方已表明严重关切 O网页链接 ​
