博主,id,时间,来源,收藏,转发,评论,点赞,艾特,标签,内容
时代作文,5917804563.0,04月13日 22:56,华为Mate20保时捷设计,,4.0,9.0,3.0,,#55.2%日本网民支持福岛核废水排海#,  这事儿，日本人自己投票好使吗？祸祸别人，自己同意就行了？这是什么混蛋逻辑？ ​
吴早早1号,3630634277.0,04月13日 22:56,前后2000万 OPPO R11s,,,,,,#福岛核废水57天可废掉半个太平洋#,日本人应该先弄死日本政府这群废物 ​
郑氏交易,5391250544.0,04月13日 22:56,微博 weibo.com,,,,,,#日本核废水排海后海鲜能放心吃吗#我们目前最担心的问题是海产品还能不能吃？虽说全球的水都相通，但考虑到洋流方向、我国江河东流入海形成的压力差等等，有的海产品以后真的要慎重了，有的还可以吃。带鱼、大小黄鱼、鲳鱼这些中国有的、不是来自深海的鱼是可以吃的，蛤蜊、花甲、蛏子、泥螺、扇贝、淡菜这些贝壳类生活的地方离陆地不远，江河东流入海的压力差“冲”走了带辐射污染的海水，它们也基本没有问题。我国是鱿鱼进口大国，以后吃鱿鱼要慎重，尤其慎吃美国西海岸和南美秘鲁等地的鱿鱼。大龙虾也应当慎重。三文鱼看产地，挪威、英国出产的自然没有问题，如果是日本、美国、加拿大出产的要谨慎。当然了，我不是专业人士，如果进口海鲜放射性超标了，中国海关自然会拦截的。老百姓饭桌上常见的带鱼等海产品受影响应该不会很大，大家保持谨慎，购买中高档进口海鲜时注意一下产地就行了，但也不必过分恐慌去囤一大堆货。虽说万幸洋流不是直冲我们而来，中国的江河也大多东流入海，但我们也不可能独善其身。辐射污染并不只是随洋流的，它也能参与到水循环中，化为水汽变成云雨落到我们头上。日本并不是因为技术上存在无法攻克的难题才排放核废水的——按正常处理方法，核废水放在那些大水罐里三十年，辐射就会降低到安全水平，那时再排放是没有问题的。而东京电力公司不愿意掏钱租地皮来放大水罐，这才排放核废水祸害全世界。环太平洋国家应该立刻采取行动，让他们悬崖勒马。#日本政府正式决定福岛核废水排海#, 收起全文d
一只远眺雪峰_Cat,1842578804.0,04月13日 22:53,微博视频号,,,,,,-,【全解日本核废水排海（三）真的安全吗？】2019年，美国伍兹霍尔海洋研究所称，核污水中含碘-129、锶-90、钌-106、碳-14等放射性元素。其中，碘-129可以导致甲状腺癌，锶-90更被世界卫生组织列入一类致癌物清单，易致白血病。绿色和平组织指出，福岛核污水中的放射性同位素碳-14和其他放射性物质的含量之高相当危险，存在损害人类DNA的潜在危险。德国海洋科学研究机构指出，福岛沿岸拥有世界上最强的洋流，从排放之日起57天内，放射性物质将扩散至太平洋大半区域，10年后蔓延全球海域。O网页链接 L国际金融报的微博视频 收起全文d
wkeyU9-,5261159956.0,04月13日 22:56,iPhone客户端,,,,1.0,,#如何看待日本福岛核废水排海#,就nm离谱 ​
FM963,1963863007.0,04月13日 22:56,微博视频号,,,,,,#海霞批美日同流合污祸害别国#：刷低下限！】日本决定将福岛核废水排入太平洋，美国居然表示支持。如此同流合污，真是刷低下限！#网友提议将日本核废水运到美国#储存和处理，毕竟日本称没地方储存，美国又说核废水符合安全标准。运费也不是很贵，这样岂不正好成人之“美”？最后说一句：太平洋不是美日两国间的内海，其他国家不容你俩祸害！#主播说联播#,【 L央视新闻的微博视频 收起全文d
阿婷你在烦恼什么呢,1865471067.0,04月13日 17:34,微博视频号,,,,,,-,美国支持日本核废水入海？赵立坚：希望美方在真正的环境问题上对事不对人。 L共青团中央的微博视频 ​​​
李小科13659987275,7524212213.0,04月13日 22:56,腾讯新闻客户端,,,,,@腾讯新闻,#腾讯新闻# 日本财务相称福岛核废水比中韩浓度低，喝了也没事 但菅义伟没喝O日本财务相称福岛核废水比中韩浓度低，喝了也没事 但菅义伟没喝#, 来自@腾讯新闻 ​
灵0001372,7349708277.0,04月13日 22:55,vivo智能手机,,,,,,#福岛核废水57天可废掉半个太平洋#,不买任何日本产的东西，没人买，你们就不用生产了，也不用造这么多垃圾了，这是我唯一能为地球做的小贡献了 ​
乐隅,5975119036.0,04月11日 20:40,iPhone 11 Pro Max,,1.0,,1.0,,-,可能有小伙伴不知道，福岛核电站跟切尔多贝利一样，都是最高等级的核事故，7级，而且相比较而言，日本那个缺德的多的多，断子绝孙那种缺德。这次说要把废水排入太平洋，其实不是第一次说，好几次了，考虑到最晚2022年那些废水没地方放了，所以他们要反复提，直到大家骂不动了，然后他们偷摸把水倒掉，就这么一堆小机灵缺德鬼。 还好那玩意会先跟着洋流去美国，咱们影响不大，心情多少能好点。 收起全文d
Reimer520,2206915727.0,04月13日 22:55,微博 weibo.com,,,,,,#如何看待日本福岛核废水排海#    那时候的他已经有了喜欢#杨紫黄梓瑕#,的女孩。 ​
散粉妥妥,3494684040.0,04月13日 22:55,iPhone客户端,,,,3.0,,#福岛核废水57天可废掉半个太平洋#, 最爱的鱿鱼、斑节虾、鲍鱼以后都不能吃了，我恨小日本！ ​
小韭菜不迷路队队长,2295636517.0,04月13日 22:55,荣耀V20 4800万3D相机,,,,2.0,,#如何看待日本福岛核废水排海#,4月13日，日本政府正式决定向海洋排放福岛第一核电站含有对海洋环境有害的核废水。日本人说了净化后能喝，美国人表示认同。那我们也同意你们直接当饮用水喝了，海洋不缺你们这点废水。 ​ ​
春天的夜风清清凉凉地吹,6538216455.0,04月13日 22:55,nova4e 3200W立体美颜,,,,,,#福岛核废水57天可废掉半个太平洋#,日本别干那损人不利己的自私恶毒事好吗？ ​
FM963,1963863007.0,04月13日 22:55,HUAWEI P30 Pro,,,,,,#55.2%日本网民支持福岛核废水排海#,【雅虎新闻调查： ​​​】4月13日，日本雅虎新闻就“福岛核废水排海 ​​​”一事展开调查，截至目前共有6万多人投票，其中55.2%的日本网民投了“赞成”票，41.8%的日本网民投了“反对”票。 ​​​
软软奶兮,1799736163.0,04月13日 15:46,微博视频号,,,,,,-,教练说你千万别说他，他刚刚捡了一块玻璃。我问为什么捡玻璃，嗯哼说：“大海是我家 ，文明靠大家 ，（玻璃）不想被别人踩到。”omg，被宝贝感动了 O网页链接 ​
中国反邪教,1590753120.0,04月13日 22:55,无邪君的Android,,8.0,5.0,7.0,,#研究机构模拟日本核污水排海扩散#】13日，#日本政府正式决定福岛核废水排海#。污水排放到海会产生哪些影响？首先，日本太平洋沿岸海域将受到影响，特别是福岛县周边局部水域，之后污水还会污染东海。德国海洋科学研究机构指出，从排放之日起57天内，放射性物质将扩散至太平洋大半区域，10年后蔓延全球海域。从模拟效果图可见，放射性物质会随着时间持续扩散，进而蔓延至全球海域。#福岛核废水57天可废掉半个太平洋#,【 收起全文d
四月壹日君寻-,7337256070.0,04月13日 18:24,HUAWEI Mate30 Pro 5G,,,,,,-,对了 我没记错的话当年毛子证明没问题是能源部部长亲自去水里游泳然后还活到90几的，日本和精日不亲自喝几口核废水然后直播游泳，你们说破天也真的没有说服力诶，大家说对吧 大家说为什么日本那个谁就是不敢喝呢 ​
欣怡belief--,5825641684.0,04月13日 22:55,iPhone客户端,,,3.0,,,#赵立坚说日本不能将福岛核废水一倒了之#,太坏了！我就想问如果日本真的把核废水倒了 影响了太平洋！更影响了全人类的生活保证！ 那咋办啊？有没有研究人员研究哈再把核废水净化哈 净化到对人类无害的水  这应该也是一个课题吧！会不会走到这一步 2成都·犀浦 ​
用户6287067738,6287067738.0,04月13日 22:55,iPhone客户端,,,,,,#福岛核废水57天可废掉半个太平洋#,我们为什么不抵制东京奥运会 ​
千羽大人Tesia,1742001577.0,04月13日 17:22,微博视频号,,,,,,#福岛核废水57天可废掉半个太平洋#】#日本核废水入海危害有多大#,【研究机构计算结果显示，？一家来自德国的研究机构计算结果显示，从排放日起，57天内放射性物质就将扩散至太平洋大半区域，3年后美国和加拿大就将遭核污染影响。同时，核废水对海洋环境、渔业资源、食品安全和人类健康将产生重大影响。 L环球资讯的微博视频 收起全文d
六翼天使1216,1408854345.0,04月13日 22:55,学习强国客户端,,,,,,-,新华国际时评：排放核废水入海，日方不可一意孤行 O网页链接 ​
原来不是普通用户呀,2460945185.0,04月13日 22:55,Android,,,,,,#福岛核废水57天可废掉半个太平洋#,还能住沿海吗？还能吃海鲜吗？ ​
阳光刺痛眼眸丶7,7474636182.0,04月13日 22:55,OPPO超视野全面屏R15,,,,,,#赵立坚说日本不能将福岛核废水一倒了之#,日本人真是一如既往的坏，江山易改，本性难移 ​
珍爱小王子,7212107869.0,04月13日 22:55,OPPO Reno3 Pro 5G,,,,,,#福岛核废水57天可废掉半个太平洋#,做个人吧 ​
蒝小鱼,7403912664.0,04月13日 16:33,微博视频号,,,,,,#赵立坚说日本不能将福岛核废水一倒了之#】今天的外交部例行记者会上，赵立坚答记者问时表示：“福岛第一核电站发生了最高等级的核事故，其产生的废水同正常运行的核电站废水完全是两回事，否则这些年日方也没必要用罐子把这些水严密封装起来。”同时，#赵立坚向日媒列举各方对核废水入海意见#,【并强调：对于这些权威机构和专家的意见，日方应予以诚实回应，而不能充耳不闻，更不能罔顾国际公共利益，将福岛核废水往海里一倒了之。（总台央视记者申杨 张熙）L央视新闻的微博视频 收起全文d
智慧树下唠嗑,6808362488.0,04月13日 21:22,微博 weibo.com,,,,,,#日本政府竟然制作了放射性氚吉祥物#, 日本复兴厅，为宣传“福岛核污水排放入海”无害，今天发布了一个“放射性氚”的吉祥物 😱 真是服了…… ​
每天都想吃辣椒萝卜,5494469809.0,04月13日 22:55,OnePlus 6,,,,5.0,,#日本核废水#,大家一起死算了，反正活着压力也挺大的，欧美人也逃不掉，初中生都知道水循环水循环，可能有些人肩膀上真的顶的是个鱼缸 ​
拾遗曲,3285406340.0,04月13日 17:22,微博视频号,,,,,,#福岛核废水57天可废掉半个太平洋#】#日本核废水入海危害有多大#,【研究机构计算结果显示，？一家来自德国的研究机构计算结果显示，从排放日起，57天内放射性物质就将扩散至太平洋大半区域，3年后美国和加拿大就将遭核污染影响。同时，核废水对海洋环境、渔业资源、食品安全和人类健康将产生重大影响。 L环球资讯的微博视频 收起全文d
愛卜夠---Jaejoong,1691032753.0,04月13日 22:55,Share微博客户端,,,,,,#日本政府正式决定福岛核废水排海#,日本政府真的是一个让人极度不适的政府啊。 ​
不名一V,3903305474.0,04月13日 17:22,微博视频号,,,,,,#福岛核废水57天可废掉半个太平洋#】#日本核废水入海危害有多大#,【研究机构计算结果显示，？一家来自德国的研究机构计算结果显示，从排放日起，57天内放射性物质就将扩散至太平洋大半区域，3年后美国和加拿大就将遭核污染影响。同时，核废水对海洋环境、渔业资源、食品安全和人类健康将产生重大影响。 L环球资讯的微博视频 收起全文d
加减乘除畅,6324570235.0,04月13日 22:55,HUAWEI P30 Pro,,,,4.0,,#日本政府正式决定福岛核废水排海##美国支持日本福岛污水入海决定#, 谁来借我一个百慕大三角一个投日本首相府邸一个投白宫核污染废水从上流流出，下流直接灌溉到这俩地让他们DNARNA疯狂电离端粒全部ko蛋白质mmd失活细胞皱缩屁股长到脸上放屁自己鼻子能闻到屎味最好能保持这种状态长命百岁 2南京·东南大学(九龙湖校区) 收起全文d
Dobbyyyyyy,5012190370.0,04月13日 22:55,iPhone客户端,,,2.0,3.0,,#福岛核废水57天可废掉半个太平洋#,我海洋遥感专业研究生第一个表示不同意🙅 ​
吃喝玩乐嗨IN广州,2064035831.0,04月13日 22:55,iPhone客户端,,,1.0,2.0,,#日本首相拒绝饮用稀释后的核废水#】2020年9月26日，日本首相菅义伟视察福岛第一核电站。他问“处理后的核废水能否饮用”，工作人员回应“如果稀释就可以喝”，菅义伟双手接过水瓶但最终没有喝下去。#日本首相没有喝稀释后的核废水#,【日本核废水能喝吗？ L小央视频的微博视频 ​​​
絮雨酥烟,1135781447.0,04月13日 17:59,微博 weibo.com,,,,,,#日本核废水排入海洋影响有多大#【四问日本核废水排放入海！】#关注日本福岛核污水排放#, 日本选择的排水方案给出的理由是，含有62种放射性物质的ALPS处理水在排放前将再次进行ALPS处理，处理前约72%超标的核污染水经过二次ALPS处理，除氚以外，其他各类放射性物质的浓度总和将低于法定的排放限制值。对目前暂无有效方法清除的氚，将把其浓度稀释到1500Bq/L（法定告知浓度为60000Bq/L）后排放入海，而且会把每年排放量的上限控制在氚22万亿Bq内。按照这种排放规模，排放海域的辐射强度不会超过日本规定的1mSv/年法定值。单从数值上看，日本政府探讨中的这一方案，氚的排放量并不高，但是福岛县的许多团体及市民依然高声反对，诟病不已，主要有这么几方面的原因。处理水只是氚超标？如何证明排放污水做到了这一点？污水罐真的没有地方可以再建了吗？氚对人体的危害真的小吗？该如何预防氚的辐射损害？戳下图了解↓↓（科技日报记者 陈超，设计：杨凯） 收起全文d
Little小森,5767627468.0,04月13日 22:55,小米CC9,,,,,,#福岛核废水57天可废掉半个太平洋#,岛国人民没有游街反抗吗，这是人做的事吗，不是自取灭亡吗。。。希望这事能妥善处理 ​
五道沟视点,2611305817.0,04月13日 22:55,五道沟超话,,,2.0,2.0,,#赵立坚说日本不能将福岛核废水一倒了之#,面对疯了的美帝，狂了的日本，还有什么不能的？ ​
娱乐新星历,6635421530.0,04月13日 22:55,Android,,,,,,#福岛核废水57天可废掉半个太平洋#,日本快灭国吧，还世界一个清净 ​
庞亚辉感悟营销,1497305883.0,04月13日 22:55,iPhone客户端,,,,1.0,@凤凰新闻客户端,#凤凰新闻#,【国际原子能机构总干事对日本核废水排放入海决定表示“欢迎”】【环球网报道】国际原子能机构(IAEA)刚刚在推特上发文，称该机构总干事格罗西对“日本宣布决定如何处理在福岛第一核电站中储存的核废水”的声明表示欢迎。格罗西还说...O国际原子能机构总干事对日本核废水排放入海决定表示“欢迎”来自@凤凰新闻客户端 ​
中国路网,3267315877.0,04月13日 22:55,微博视频号,,,,,,#中国路网##路路知多少# 【#赵立坚说日本不能将福岛核废水一倒了之#】今天的外交部例行记者会上，赵立坚答记者问时表示：“福岛第一核电站发生了最高等级的核事故，其产生的废水同正常运行的核电站废水完全是两回事，否则这些年日方也没必要用罐子把这些水严密封装起来。”同时，#赵立坚向日媒列举各方对核废水入海意见#,并强调：对于这些权威机构和专家的意见，日方应予以诚实回应，而不能充耳不闻，更不能罔顾国际公共利益，将福岛核废水往海里一倒了之。（总台央视记者申杨 张熙）L央视新闻的微博视频 收起全文d
于震澴,1269182502.0,04月13日 22:55,百度App,,,,,,-,《突发！日本正式决定：福岛核废水将排向大海！科学家的“推演图”让人害怕，海鲜还能放心吃吗？》据人民日报客户端报道，日本政府4月13日早上召开相关阁僚会议，正式决定向海洋排放福岛第一核电站含有对海洋环境有害的核废水。O网页链接 ​
李现在我被窝里,1795196521.0,04月13日 22:55,李现宝宝Android,,,1.0,0.0,,#福岛核废水57天可废掉半个太平洋#,有小节无大义的国家 ​
方方唐唐1999,1317421182.0,04月13日 22:55,新浪新闻客户端,,,,,,#赵立坚说日本不能将福岛核废水一倒了之#】 #跟新浪看热点#,我在看：【【新浪热榜】 O新浪新闻圈子：赵立坚说日本不能将福岛核废水一倒了之 ​
夏日恋啵序曲,6340153058.0,04月13日 22:55,TFBOYSAndroid,,,,,,#日本核废水#,放过世界，放过人类，也放过你们自己吧... ​
井底的老蟾蜍,7395006015.0,04月13日 19:46,HUAWEI P30 Pro,,,,,,#V光计划#,日本副首相兼财政部长麻生太郎今天信口开河，声称日本福岛核电站的核废水比中韩核电站废水的氚浓度还低，“喝了也没啥事”。好啊，就请他麻生太郎带头喝一个月福岛的核废水，日本阁僚也都跟着一起喝，那样最能够证明那些核废水是干净达标的。而且我就纳闷了，那么干净的水排到大海里多可惜，就做成瓶装水在日本全境销售不是挺好的吗？他麻生太郎应该做这个建议啊。至少也把它们在日本搞成一个人工湖，麻生太郎和日本阁僚周末经常带家人去划划小船，不也挺好吗？ 麻生太郎别光嘴硬，希望与他一起支持向海洋排放核废水的日本阁僚来点真的，以安天下之心。  收起全文d
心火燃烧_,5525905944.0,04月13日 22:55,华为P9手机摄影再突破,,,1.0,,,-,推上日本🇯🇵 排放核废水标签下面吵翻天了部分日本人叫屈  中韩则是口绽芬芳 ​
咸_西瓜,6358580374.0,04月13日 22:55,Share微博客户端,,,,,,#日本核废水#,日本政府能不能做个人 ​
InAsnowhere_0203,6775037409.0,04月13日 22:55,HUAWEI nova 3,,,,,,-,和朋友讨论日本核电站排放废水的事情。她觉得难过而气愤，感叹环境之糟糕。我甚至有些麻木。从澳洲大火到燃烧的亚马逊雨林。每年都是“史上最热年”，南北极的的海冰都在融化 。大批的国际会议，条约，宣言，很多最后只变成了扯皮。很多时候环境保护甚至变成了某种工具，被用于其他的宣传目的，无论是支持环保还是反对环保。一些“环境友好”的举措并没有真的环境友好。比如蚂蚁森林种树。外卖点“无需餐具”会有绿色能量，但很多商家都会继续提供一次性餐具。kfc麦当劳里就算你选择堂食，也经常会给你外包装的纸袋。我甚至觉得有些“绿色”是满足消费者个人的良心需求，让大家能够消费的没有那么内疚，包括我自己这个自称“环保”很多年的人。我也更喜欢便捷的生活方式，接受很多一次性的制品，也会点外卖，坐飞机，而且经历了更好的物质条件之后不太愿意回到低物质条件中去。趋向更高的生活水平是人之常情，同时也加剧环境的负担——那么，出路在哪里？新的技术能够更清洁，更便利，并且快速跟上社会需求吗？会不会千万年后，新的智慧生物考证我们的化石，将我们所生活的时代定义为“物种大灭绝”？ 收起全文d
clearjw,7546370440.0,04月13日 18:54,HUAWEI nova 3,,,,,,#如何看待日本政府正式决定福岛核废水排海# ？【#赵立坚说日本不能将福岛核废水一倒了之#】今天的外交部例行记者会上，赵立坚答记者问时表示：“福岛第一核电站发生了最高等级的核事故，其产生的废水同正常运行的核电站废水完全是两回事，否则这些年日方也没必要用罐子把这些水严密封装起来。”同时，#赵立坚向日媒列举各方对核废水入海意见#,你并强调：对于这些权威机构和专家的意见，日方应予以诚实回应，而不能充耳不闻，更不能罔顾国际公共利益，将福岛核废水往海里一倒了之。（央视新闻） 你如何看待日本政府决定福岛核废水排入海洋？ 收起全文d
山西运城反邪教,2801088387.0,04月13日 18:06,无邪君的Android,,,,,,#外交部回应美方支持日本核废水入海#,美称日本排核废水似乎符合全球安全标准，赵立坚双引号手势回应：希望美国对环境问题的重视不要被打上引号。（人民日报） L中国反邪教的微博视频 ​
西南科大经济管理学院,7538466426.0,04月13日 22:55,OPPO A91,,,,,,#经心为你推#,日本政府13日召开内阁会议正式决定，福岛第一核电站核污水经过滤并稀释后将排入大海。      赵立坚说，日本福岛核事故是迄今为止全球发生的最为严重的核事故之一，事故造成大量放射性物质泄漏，对海洋环境、食品安全和人类健康已经产生深远影响。妥善处置福岛核电站废水问题关系到国际公共利益和周边国家切身利益，理应慎重妥善把握，确保在各有关方共同参与下，有效避免对海洋环境、食品安全和人类健康带来进一步损害。目前国际舆论对日方拟决定核废水排海高度关注，普遍表示质疑和反对。日本国内也有不少强烈反对意见。我注意到日方经常要求他国履行国际责任，现在国际社会都在看着日方，日方不能视而不见、听而不闻。此事关系重大，日方应对国际公共利益负责，这也是对本国民众利益负责。为维护国际公共利益和中国人民健康安全，中方已通过外交渠道向日方表明严重关切，要求日方切实以负责任的态度，审慎对待福岛核电站核废水处置问题。      国际原子能机构总干事格罗西12日在会见中国常驻维也纳联合国代表王群时，就日本政府拟决定将福岛核电站有害废水排海事表示，机构注意到各方对此事的关切，理解此事正受到全球关注，愿以公正、客观、科学的方式积极推进机构对此的评估和监督工作。在此过程中，机构愿与各利益攸关方加强沟通。当前，应努力避免此事进一步危害海洋环境、食品安全和人类健康。      王群表示，对日本拟决定核废水排海事，中国外交部发言人今天就此表达了关切。中方支持国际原子能机构在评估和监督方面发挥重要作用。同时，作为周边国家，中国与其他所有利益相关国理应参与机构评估和监督。 收起全文d
北白川鹿见,5835940928.0,04月13日 22:44,●REC  Android,,,,,,-,我完全理解了( ﾟA。) ​
看到这你要开心哦,7103015455.0,04月13日 22:55,海信智能手机,,,,,,#福岛核废水57天可废掉半个太平洋#,裂开 ​
戎川D,2937297665.0,04月13日 22:55,Samsung Galaxy S8+,,,,1.0,,#日本核污水57天将污染半个太平洋##日本政府正式决定福岛核废水排海#,如果日本向大海倾倒核废水，海洋是什么样的存在？我怎么那么想日他本人 ​
山西运城反邪教,2801088387.0,04月13日 18:44,无邪君的Android,,,,,,#赵立坚说日本不能将福岛核废水一倒了之#,赵立坚：日方不能罔顾国际公共利益，将福岛核废水往海里一倒了之！（新华每日电讯） L中国反邪教的微博视频 ​
庄哇塞Tanya,7417891213.0,04月13日 22:55,iPhone客户端,,,,,,#如何看待日本福岛核废水排海#,小日本活该被打，真的是不怕有哥斯拉？这东西美国佬不插一句就亏了，稀释后能喝宁咋不先干两桶下去啊，相比于全球温室效应碳减排，这个核污染可能是目前最应该解决的事，这种神操作能造福几代人？活该它小日本经历过要灭亡的时刻 2泉州·惠安县 ​
傲游周章,5873582335.0,04月13日 22:54,微博视频号,,1.0,1.0,,,#海霞批美日同流合污祸害别国#：刷低下限！】日本决定将福岛核废水排入太平洋，美国居然表示支持。如此同流合污，真是刷低下限！#网友提议将日本核废水运到美国#储存和处理，毕竟日本称没地方储存，美国又说核废水符合安全标准。运费也不是很贵，这样岂不正好成人之“美”？最后说一句：太平洋不是美日两国间的内海，其他国家不容你俩祸害！#主播说联播#,【 L央视新闻的微博视频 收起全文d
熙瑄瑄,6033577745.0,04月13日 22:54,iPhone客户端,,,,,,#福岛核废水57天可废掉半个太平洋#,… ​
禾火2982257,5255031436.0,04月13日 22:54,微博极速版,,,,,,#福岛核废水57天可废掉半个太平洋#, 日本人👎🏻👎🏻👎🏻👎🏻👎🏻👎🏻👎🏻 ​
