博主,id,时间,来源,收藏,转发,评论,点赞,艾特,标签,内容
Dear-鱼小丸,7541921171,04月14日 17:19,微博视频号,,,,,,#赵立坚说请日本官员先喝核废水#】#日本副首相称喝处理核废水没事#,【，赵立坚：那请他喝了再说！ L央视新闻的微博视频 ​
暖暖Raby,2011973207,04月14日 22:47,HUAWEI Mate30 Pro 5G,,,,,,#日本核废水入海对中国有何影响#, 哥斯拉真的要诞生了……喵了个咪……我最爱的海鲜……啊…… 2成都 ​
大姨妈不要痛,1171307974,04月14日 22:01,微博 weibo.com,,,,,,#王志文力挺任豪#,前营人王志文力挺任豪，还表示是出于好意的话语，之后又删掉了微博 ​
脑洞创作指南,2126472660,04月14日 22:47,iPhone客户端,,,,7,,#任豪回应#,今天刚被科普到切诺尔贝利核电站的历史，再看着他，这是人说的话吗，还是个公众人物？当初苏联这个核电站危机是用了牺牲了好几万人的血肉之躯才解决，日本明明有那么多解决方案，选择了最无耻的一种，竟然还有中国人觉得应该让中国去帮他解决？你难道认为日本它是不知道怎么解决这个核废水问题吗？放p，它就是自私，害怕牺牲，损人不利己 收起全文d
大兴-清韵,6568518283,04月14日 13:34,无邪君的Android,,,,,,#美国禁止日本食品进入# #日本副首相称喝处理核废水没事#,美国食品药品管理局FDA近日发布第99－33进口警示，禁止下列日本食品进入美国：鲜奶、黄油、奶粉、婴儿奶粉、及其它奶制品；蔬菜、及其制品；大米、全麦；鱼类；肉类和禽类；蛤蜊类；海胆；柑橘柚类水果；奇异果，等等。原因是核污染。详细列表见FDA的公告↓ 收起全文d
再燃一根烟就,1874864837,04月14日 16:45,HUAWEI Mate 30 5G,,,,,,-,印度杀疯了！干的太漂亮！ ​
风一样的听风呵,6554987187,04月14日 17:19,微博视频号,,,,,,#赵立坚说请日本官员先喝核废水#】#日本副首相称喝处理核废水没事#,【，赵立坚：那请他喝了再说！ L央视新闻的微博视频 ​
像鲸鱼一样呀,6608182761,04月14日 22:47,搞事业超话,,,,,,#文在寅欲起诉日本核污水入海 #, 支持支持日本官员多喝喝废水身体也没事的啦!  好喝就多喝一点啊   ​
爱国红色小青年,5795310603,04月14日 22:47,iPhone客户端,,,,,,#赵立坚说请日本官员先喝核废水#,还不是你们这群日杂，天天吹啊。现在还吹不。 ​
埃莉峿之·,7278490040,04月14日 22:47,360安全浏览器,,,,,,#日本政府正式决定福岛核废水排海#,这次事件就是很严重苏联当时核泄漏那块现在还是无人区这个逼玩意还排 ​
信用卡积分bot半步学长,5073741123,04月14日 22:47,iPhone客户端,,,,,,#赵立坚说请日本官员先喝核废水#,请日本高举手中的酒杯，喝下这杯核废水 ​
很像一个多雾的秋天,7490978467,04月14日 22:47,vivo Y5s 闪充强续航,,,,,,#日本核废水入海对中国有何影响#, 相信在日本的帮助下，人类进化指日可待 ​
五楼太难爬了吧,3885534684,04月14日 22:47,OPPO K5,,,,,,#脱粉##日本核废水入海对中国有何影响##任豪回应#,    不如你一口一口喝掉？ ​
爱斯基摩的雀斑姑娘,1786105444,04月14日 22:47,iPhone客户端,,,,,,#王志文力挺任豪#,就是俩善良的傻子吧。作为公众人物，就不应该说这种愚蠢的“圣人言论”。面对别人的一倒了之的无耻姿态，还要做“圣人”，以自我牺牲的方式给人家擦屁股，将核废水搬到国内处理，简直是损己利人的傻瓜。王志文等待帮助的言论就更好笑，日本这是等待帮助的态度吗？这明显是破罐破摔、毫无责任感的国家好吗？！他一直不倒是因为忌惮美国！忌惮国际社会压力！如今美国一同意，他立刻就露出自私自利的小国寡民本性。面对一个毫无牺牲感的民族，你现在代表中国去自我牺牲，是不是舔狗？是不是在无视日本的无耻行径？这是在日本发生的核泄漏事故，若要提供帮助，你大可以说期待成立全球的处理废水研究小组，提供专家、技术、人才，但将“罩子扩大”这种简单粗暴的提议，是在帮小日本弱化责任无疑了！ 收起全文d
是梨子云,3730808253,04月14日 17:19,微博视频号,,,,,,#赵立坚说请日本官员先喝核废水#】#日本副首相称喝处理核废水没事#,【，赵立坚：那请他喝了再说！ L央视新闻的微博视频 ​
月亮小时工叁叁,5496453121,04月14日 22:47,iPhone客户端,,,,4,,#王志文力挺任豪#,你们一起去喝点核废水治治脑子吧 ​
苏羽菲西,7580194196,04月14日 16:24,微博视频号,,,,,,#赵立坚说太平洋不是日本的下水道#,【】今天，外交部发言人赵立坚强调：“海洋不是日本的垃圾桶，太平洋也不是日本的下水道！日方处理核废水，不应让全世界买单。”至于日本个别官员称这些水喝了也没事，请他喝了再说。（总台央视记者申杨 张熙 杨毅） L环球资讯的微博视频 ​
Lhl蜉蝣,5411023236,04月14日 22:47,iPhone客户端,,,,,,#赵立坚说请日本官员先喝核废水#,漂亮，小日本既然说可以喝，那就让他们自己喝光，别出来害人 ​
我贤美如画,3807228102,04月14日 16:45,OPPO Reno5 Pro 5G,,,,,,-,印度杀疯了！干的太漂亮！ ​
JFMSL,2724739833,04月14日 18:54,HUAWEI nova 2s,,,,,,-,抱歉，此微博已被作者删除。查看帮助：O网页链接
文鋒而來一影音E時代,2298800112,04月14日 22:46,微博 weibo.com,,,1,1,@文鋒而來一影音E時代】,#寰宇全视界#,【★★第2021-04-14期（无广告合成版）】本期内容：中国仍是未来三年全球最重要市场，日本核灾十年后核废水仍是头等大难题！【节目主持：岑永康| 出席来宾：陈志峰&黄奎博&郭正亮】【付费观看：节目收费观看，可微博私信或加Q联系224392207，包月者可专属一对一分享，非喜勿扰！@文鋒而來一影音E時代】 O【付费节目】寰宇全视界2021-04-14期【陈志峰＆黄奎博＆郭正亮】 收起全文d
南梄,5123436282,04月14日 17:19,微博视频号,,,,,,#赵立坚说请日本官员先喝核废水#】#日本副首相称喝处理核废水没事#,【，赵立坚：那请他喝了再说！ L央视新闻的微博视频 ​
太原新闻网官方微博,2346031615,04月14日 22:46,360安全浏览器,,,1,,,-,拉全世界买单 日本一意孤行排核废水入海O拉全世界买单 日本一意孤行排核废水入海 ​
临沂河东环境,1737762607,04月14日 18:26,Android,,,,1,,#赵立坚说请日本个别官员喝了核废水再说#】针对日本政府正式决定以海洋排放方式处置福岛核电站事故核废水，14日，外交部发言人赵立坚三连问斥责日方：①日方真的听到了国内外的质疑和担忧吗？#311个环保团体向日方表示坚决反对#,【②日方此举真的符合国际法吗？日方决定将开创严重核事故处理后废水向海洋排放的先例。③日方拟排放的核废水真的符合国际标准吗？据东京电力公司统计，核废水中共含有62种放射性核素。赵立坚强调：“海洋不是日本的垃圾桶，太平洋也不是日本的下水道！日方处理核废水，不应让全世界买单。”至于你提到的日本个别官员称“这些水喝了也没事”，那请他喝了再说。（人民日报记者李欣怡）L人民视频的微博视频 2临沂 收起全文d
可爱的夏夏子,6483359053,04月14日 22:46,nova5i 2400万AI四摄,,,,,,#更大的罩子#,哈哈哈哈哈哈哈哈哈哈卧槽 今日份快乐是任豪给的，没十年脑血栓说不出来这种话，真的是有那个大病，说话之前不过脑子是急于证明自己九漏鱼的身份吗，小学生说话都比他有水准，没有那个水平就不要碰zz话题，麻烦用一个罩子把这个无脑小伙罩住打包丢到外太空顺便送他几杯核电站废水让他安享晚年体验一下人生疾苦，我看是生活太安逸让他产生了不切实际的错觉，就这还有粉丝坚持洗真是世界之大无奇不有 收起全文d
弥城猫巷吖,7386775257,04月14日 17:19,微博视频号,,,,,,#赵立坚说请日本官员先喝核废水#】#日本副首相称喝处理核废水没事#,【，赵立坚：那请他喝了再说！ L央视新闻的微博视频 ​
宝鸡文理学院政法学院团总支,2382110980,04月14日 22:46,华为畅享10 Plus,,,,,@宝鸡文理学院@宝鸡文理学院电气学院团总支@BMDcS@Toys77-,#政法·新闻# 【#反对一倒了之#！#一图看懂日本核废水排海危害#,】①福岛核废水处理后仍含放射性核素；②核废水一旦排海，放射性物质将在57天内扩散至太平洋大半区域；③废水中所含碳14数千年内都将有影响……将核事故处理后废水排入海洋，人类从未有此先例！日本此举，极不负责！ ​@宝鸡文理学院 @宝鸡文理学院电气学院团总支 @BMDcS @Toys77- 收起全文d
5月4号的男神,7020389421,04月14日 22:46,荣耀V20 4800万3D相机,,,,,,#任豪回应#,地球是全部人的地球，那么炸了日本不就好了？这样，也不怕他们以后再有排核废水往海里的举动了毕竟谁知道这只是一次，还是次次都要别人来给它擦屁股呢？日本都能做出这种行为了，地球可持续发展在他们眼里算什么？感情这位还觉得自己被骂很光荣了？ ​
宇宙xkitty,6342795744,04月14日 22:46,微博国际版,,,,,,#日本政府正式决定福岛核废水排海#,  小日本人快喝了吧 ​
丸圆的啦,5299025839,04月14日 22:46,小米10,,,,1,,#赵立坚说请日本官员先喝核废水#,没毛病 你敢说没事 你先喝给世人看 ​
妖里妖气的蘑菇,6077642942,04月14日 22:46,HUAWEI P30,,,,,,#赵立坚说请日本官员先喝核废水#,单靠说没用，所以还是请日本官员先喝为敬…… ​
云定化天,3822329467,04月14日 21:56,iPhone X,,,,,,-,保护环境人人有责晚安 ​
ArmedRodent,5400525189,04月14日 22:46,微博 weibo.com,,9,1,4,@日本国驻华大使馆,#日本副首相称喝处理核废水没事#,@日本国驻华大使馆 速速转告你家主人，别倒海里了，我给你们的废水想了销路。万全之策金点子，一吨水给我个百八十万日元策划费不为过。  ​
兄嘚吃饼嘛,2726707743,04月14日 21:22,nova7Pro你在焦点在,,,,1,,-,营人王志文力挺任豪：日本说了好几次要放海里都没放，感觉就是在等待帮助，科学家们解决过很多次危机，这次也好好想想吧，请理性对待那些想办法想变好的人吧 ​
颜辞镜不殊,6659950186,04月14日 17:19,微博视频号,,,,,,#赵立坚说请日本官员先喝核废水#】#日本副首相称喝处理核废水没事#,【，赵立坚：那请他喝了再说！ L央视新闻的微博视频 ​
太原新闻网官方微博,2346031615,04月14日 22:46,360安全浏览器,,,,,,-,【新闻1+1丨日本核废水入海，“核”试吗？合适吗？】4月13日，日本政府正式决定将福岛核废水排海。此举不仅引发日本国民的不满和质疑，中国、韩国等周边国家也都纷纷表示反对：这种做法极其不负责任，将严重损害国际公共健康安全和周边国家人民切身利益。日本为什么这么做？由此带来的影响是什么？核废水入海，真能“一倒了之”吗？ 日本核废水入海，“核”试吗？合适吗？O新闻1+1丨日本核废水入海，“核”试吗？合适吗？ 收起全文d
共你此生三月花,1906444477,04月14日 22:46,微博 HTML5 版,,,,1,@共青团中央。@人民日报。,#任豪回应#,这种SB还是封杀的好。在日本丧尽天良倾倒核废水上，拿中国来向日本献媚，无端因这SB让中国为日本挡枪，其何德何能？带坏小朋友。大是大非问题，甚至敌我问题成其无知撒娇卖萌晋身之石。@共青团中央。@人民日报。 ​
QQ扭力吱呦啊喂,3950080990,04月14日 22:46,然然酱偷的Android,,,,4,,#任豪回应#,这难道就是圣母大学资深研究生？？？🙃我觉得但凡这人上个大学也不能说出这样的话啊🙃嘿，没脑子就闭嘴，娱乐圈现在是什么人都能进？？？🙃这种逼不封杀等什么？？？🙃等带着一群没脑子的粉丝去喝核废水？？？🙃 ​
兔球挺举胡萝卜,6041338368,04月14日 18:54,Redmi K30 5G先锋,,,,,,-,抱歉，此微博已被作者删除。查看帮助：O网页链接
揽风月入怀K,6728148471,04月14日 22:46,小米8周年旗舰手机,,,,1,,#日本政府正式决定福岛核废水排海#,  我仿佛看到了人类打来潘多拉魔盒 ​
加冰不加糖1_0,6453617397,04月14日 18:54,iPhone客户端,,,,,,-,抱歉，此微博已被作者删除。查看帮助：O网页链接
眉眼似星辰Roy,5673787516,04月14日 22:46,小梓666超话,,,,,,#赵立坚说请日本官员先喝核废水   #,外交官yyds！就是！你倒是喝了再说！官员说出这句话的时候也不知道他哪来的勇气 ​ipad ​
用户6136536662,6136536662,04月14日 22:46,OPPO Reno5 Pro 5G,,,,,,-,.       据说，这文是一位核电从业者写的，一看，我就知道，这作者缺乏政治素养，在大是大非面前，你谈什么事实和科学？        就像楼下大爷，有人问他，你对日本核废水排放有什么看法？大爷说，举个例子，就像你在站在游泳池边，朝泳池里撒了一泡尿，我还呛了几口，虽很恶心，但我没事，但我必须要骂你。        你看，作者远没有大爷机智。 2苏州·吴中万达广场 收起全文d
2心儿2,6078433535,04月14日 17:19,微博视频号,,,,,,#赵立坚说请日本官员先喝核废水#】#日本副首相称喝处理核废水没事#,【，赵立坚：那请他喝了再说！ L央视新闻的微博视频 ​
秋萍渐老,5682591977,04月14日 22:46,荣耀9 美得有声有色,,,,1,,#日本副首相称喝处理核废水没事#,既然如此，以身作则，你们国内自己直接喝了不就解决了 ​
陈孝军1989,6395641026,04月14日 22:46,小米6 拍人更美,,,,,,-,『史无前例！一图看懂日本核废水排海危害』O史无前例！一图看懂日本核废水排海危害 ​
坑坑_cri,3705129101,04月14日 17:19,微博视频号,,,,,,#赵立坚说请日本官员先喝核废水#】#日本副首相称喝处理核废水没事#,【，赵立坚：那请他喝了再说！ L央视新闻的微博视频 ​
禁止圣母,5690055617,04月14日 22:46,鉴表大师的iPhone客户端,,,2,8,,#任豪回应#,建议还在轮博搞热转的这几位任豪粉丝和你爱豆一起喝核废水吧 ​
未完的小说2016,2781506783,04月14日 22:46,iPhone 12 Pro,,,,3,,#日本番茄酱大王停止进口新疆番茄#,对等的，咱们也可以禁止进口日本的食品和化妆品，核废水多不安全 ​
酒咪597,6213754761,04月14日 22:01,微博 weibo.com,,,,,,#王志文力挺任豪#,前营人王志文力挺任豪，还表示是出于好意的话语，之后又删掉了微博 ​
机智可爱无敌的齐桓,6566895834,04月14日 22:46,nova6 5G自拍大不一样,,,,,,#任豪回应#,既然说得这么大义凛然，那就派你第一个去处理核废水吧。 ​
C-橘子味的橙子,6436800936,04月14日 22:46,大壳捡的iPhone 7(亮黑),,,,2,,#赵立坚说请日本官员先喝核废水#,花钱看日本官员喝核废水我都愿意  反正你们说的可以喝 你们多喝点  ​
Delight_cc,5159446517,04月14日 22:46,vivo X23全息幻彩,,,,9,,#王志文力挺任豪#,以前怎么没发现无可救药的脑残这么多？！谁说民众不关注了，谁愿意看着核废水排海里，干嘛整的好像公众都不关心这事，就得你们在那故作世人皆醉我独醒才能引起公众关注？先去看看每天外交部怎么回应的好吗？什么玩意日本想要寻求帮助，真想要寻求帮助就请做出明确表示！不是你们在这道德绑架国家！ 收起全文d
一个神奇的小号Ak,7336751227,04月14日 22:01,微博 weibo.com,,,,,,#王志文力挺任豪#,前营人王志文力挺任豪，还表示是出于好意的话语，之后又删掉了微博 ​
小绵羊的babe,5747770572,04月14日 22:46,nova5Pro人像超级夜景,,,,,,-,rh下面的评论真的好好笑哈哈哈哈 求你了 带着你的粉丝一起去喝核废水吧 ​
人型移動垃圾_,7153076320,04月14日 11:07,微博 weibo.com,,,,,,#柯南终极预告#来啦！本周六零点，熟悉的BGM将在影院再次响起。四年一届的世界体育盛会即将开幕，超级列车正以疯狂的速度冲向会场，危险的子弹已上膛。——“别担心，我会保护你的”——“不对吧，要保护你的是我”4月17日，全球一起看柯南，见证世纪营救。#柯南说要保护你的是我#, L最久的陪伴最早的相遇 收起全文d
kucky小窝34,3592086001,04月14日 22:46,微博 weibo.com,,,,,,#日本核废水入海对中国有何影响##重启之极海听雷#,快来快来 ​
晗崽的小芦,6325705974,04月14日 17:19,微博视频号,,,,,,#赵立坚说请日本官员先喝核废水#】#日本副首相称喝处理核废水没事#,【，赵立坚：那请他喝了再说！ L央视新闻的微博视频 ​
不太甜的温柔收藏家Z,6013547132,04月14日 22:46,Android,,,,,,#日本核废水入海对中国有何影响##任豪##任豪回应#,求各位拉黑，脱粉前，点一波举报先，正常人不会这么说话。 ​
Trickssrtar,7284548049,04月14日 22:46,荣耀8青春版 颜值担当,,,,,,-,草 去尼玛日本核废水，这几天看得我头疼 ​
17木木木,5848467973,04月14日 22:46,vivo Z5x性能实力派,,,,,,#任豪回应#,你带着你的粉丝一起去喝核废水吧 ​
像粗粮一样的apple,7419387154,04月14日 17:19,微博视频号,,,1,1,,#赵立坚说请日本官员先喝核废水#】#日本副首相称喝处理核废水没事#,【，赵立坚：那请他喝了再说！ L央视新闻的微博视频 ​
Charltin_长亭,7315533538,04月14日 22:46,小米11,,,,,,#赵立坚说请日本官员先喝核废水#,这不比榜一好，给爷上去 ​
鹤岗兴安检察,5601861254,04月14日 22:46,微博视频号,,2,2,3,,#福岛核废水57天可废掉半个太平洋#】#日本核废水入海危害有多大#,【研究机构计算结果显示，？一家来自德国的研究机构计算结果显示，从排放日起，57天内放射性物质就将扩散至太平洋大半区域，3年后美国和加拿大就将遭核污染影响。同时，核废水对海洋环境、渔业资源、食品安全和人类健康将产生重大影响。 L环球资讯的微博视频 收起全文d
夏夏夏热夏,7495998445,04月14日 22:01,微博 weibo.com,,,,,,#王志文力挺任豪#,前营人王志文力挺任豪，还表示是出于好意的话语，之后又删掉了微博 ​
娜娜明今天休假,5233534626,04月14日 22:46,微博国际版,,,,,,-,我的天，任豪这逼，真的又蠢又坏，没脑子爱装逼，显摆自己举世皆浊你独清？就你知道保护地球？全中国就你行，你比领导还会考量了。你这么热心怎么不去劝日本别往海里倒核废水呢？直接从源头解决不行？你那么热心你直接出钱帮日本解决不行？你不缺那转国籍的钱吧，快拜你小日本爹去吧，逼贡献不出，就口头叭叭地慷他人之慨，你倒是挺会啊。但凡你有脑子知道上网查一下，都不可能说出这种屁话。曹尼玛的，要是看见你，我非往你脸上扔臭鸡蛋不可，呸，蠢钝如猪的东西。 收起全文d
千龙网中国首都网,3215951873,04月14日 21:45,iPhone客户端,,,,1,,#京彩e品#, 4月13日，日本政府正式决定，将福岛核废水排放入海。任意妄为、一意孤行、举世惊愕，周边国家即刻表态，严重关切、强烈谴责。我外交部发言人华春莹，更在一张图片推文中发问：这是一个负责任的国家会做的事吗？  L北京日报都视频的微博视频 2北京 ​
娱乐哔哔酱,1815040952,04月14日 22:46,娱乐哔哔酱超话,,,,,,-,创造营2019-王志文力挺任豪……这尼玛选秀都是瞎的的是吗？没颜值没脑子的都能上。日本这么多年为什么没倒，就是在等你们这样的孝子啊，耍无赖逼别人给他们的恶行买单，收拾垃圾，他们好继续研究生化武器啊！糊得那么空闲就多读书，行不？糊作非为，仗糊行凶，一起去日本干核废水吧！ ​
各色风起,5806910051,04月14日 17:19,微博视频号,,,,,,#赵立坚说请日本官员先喝核废水#】#日本副首相称喝处理核废水没事#,【，赵立坚：那请他喝了再说！ L央视新闻的微博视频 ​
奥利奥的奥Wy,3815483493,04月14日 18:54,上班狗的Android,,,,,,-,抱歉，此微博已被作者删除。查看帮助：O网页链接
蔚蓝南海中绿色椰岛上一棵金椰,5644308348,04月14日 22:45,华为手机 畅享玩不停,,,,,,#赵立坚说请日本官员先喝核废水#,+1 ​
Dear_LisaBaby,6323789083,04月14日 17:19,微博视频号,,,,,,#赵立坚说请日本官员先喝核废水#】#日本副首相称喝处理核废水没事#,【，赵立坚：那请他喝了再说！ L央视新闻的微博视频 ​
晚霞中的葒蜻蜓,1449481337,04月14日 22:45,Android,,,,,,#日本拟将核污染水排入大海#, 日本首相都说核废水可以喝，希望日本把核废水喝掉不就好了吗？那就没有必要排入大海了啊。 2湛江 ​
好好学习多喝热水天天干饭,6672619873,04月14日 22:45,OPPO智能手机,,,,,,#脱粉#,还在控评的粉丝你省省吧你哥哥真的没救了没十年脑瘫真说不出这种话要不你们和他一起把核废水喝了也行🙏🙏🙏 ​
nlxx2021,5289216720,04月14日 22:45,nova4e 3200W立体美颜,,,,4,,#任豪回应#,对核废水这个东西有基础的了解吗？大言不惭就要国家去帮！？纳税人辛辛苦苦的钱让你挥霍的？？？？这时候把美韩英法德这些国家怎么忘了？？？？？ ​
小月半的羊,1889556057,04月14日 22:45,iPhone客户端,,,1,2,,-,不行了哈哈哈哈我笑死了任豪是什么品种的玛丽苏啊？感觉这智商已经是提前喝上了他日本爹的核污染废水了，公众人物在这种国际大事上不会说话或者一时脑瘫自己发发朋友圈就好了啊我爆笑了闭麦都不会吗哈哈哈r1se实属内🐟塌房no1没人质疑吧？ ​
及他及她,2165783630,04月14日 09:50,微博视频号,,,,,,#V光计划#,【逸语道破：核废水入海危及全球，还有人给日本政府做“文宣”？】日本政府想省事，东电想省钱，但即便日本政府对国际原子能机构影响巨大，他们也根本没有为日本政府开通行证。我们国内的部分自媒体哪里来的自信给日本政府“开绿灯”？说日本核废水安全的“公关稿”请不要再发了。 L沈逸的微博视频 收起全文d
Dear_LisaBaby,6323789083,04月14日 17:19,微博视频号,,,,,,#赵立坚说请日本官员先喝核废水#】#日本副首相称喝处理核废水没事#,【，赵立坚：那请他喝了再说！ L央视新闻的微博视频 ​
普嘟嘟今天能不能买彩票,2615264724,04月14日 22:45,iPhone客户端,,,2,,,-,这两天关于核废水排放的新闻和热搜我都能露出地铁老爷爷看手机的表情 ​
Hi_CME,6075533883,04月14日 22:45,微博视频号,,3,,1,,#日本政府正式决定福岛核废水排海# #日本政府基本决定将福岛核污水排入大海# #如何看待日本福岛核废水排海# #赵立坚说日本不能将福岛核废水一倒了之#,4.14 No.41 ｜福岛核废水，人人都是核物理学家？2011年3月11日，一次强地震导致的大海啸，造成日本东北部的福岛核电站冷却系统失效，六座反应堆中有三座熔毁。其严重程度达到国际核能事故等级迄今为止的最高级别，与1986年切尔诺贝利一样。十年过去，核事故对环境造成的影响依然显著，核废水问题一直未解。日本政府终于在4月13日宣布，决定将福岛核电站的核废水排放入海。 LHi_CME的微博视频 收起全文d
阿獠WEI,6395725811,04月14日 17:19,微博视频号,,,,,,#赵立坚说请日本官员先喝核废水#】#日本副首相称喝处理核废水没事#,【，赵立坚：那请他喝了再说！ L央视新闻的微博视频 ​
最佳发呆王,6289878776,04月14日 22:45,华为手机,,,,,,#任豪回应#, 任豪快和王志文一起去喝核废水 拯救地球！！🌐 ​
欣欣家的小美妞,6087971164,04月14日 22:45,OPPO智能手机,,,,,,#赵立坚说请日本官员先喝核废水#,对，让日本人自己喝了再来哔哔了 ​
平行世界里的一束光,7514013736,04月14日 17:19,微博视频号,,,,,,#赵立坚说请日本官员先喝核废水#】#日本副首相称喝处理核废水没事#,【，赵立坚：那请他喝了再说！ L央视新闻的微博视频 ​
