博主,id,时间,来源,收藏,转发,评论,点赞,艾特,标签,内容
森巴蛙跳华尔猪,1688470017,04月14日 21:40,微博 weibo.com,,,,,,#西方媒体这一次却沉默了# 美国等西方发达国家向大海倾倒核废料，早已有漫长的历史。此次，#日本政府正式决定福岛核废水排海# 不过是对其有样学样。日本和美国等西方发达国家本质上是一丘之貉，西方此举，完全是对人不对事的双标做派。#外交部召见日本驻华大使提出严正交涉# #日本70年前排废致水俣病灾害持续存在#,【海洋在怒吼——发达国家核废料排海的历史】 O海洋在怒吼——发达国家核废料排海的历史 收起全文d
酥柚奶糖,6115911029,04月14日 17:19,微博视频号,,,,1,,#赵立坚说请日本官员先喝核废水#】#日本副首相称喝处理核废水没事#,【，赵立坚：那请他喝了再说！ L央视新闻的微博视频 ​
Alitar007,6250379798,04月13日 10:30,HUAWEI Mate30 Pro 5G,,,,,,-,方舟子出马了 ，洛杉矶房东昨天也跟上了，恨国党这些人倾巢出动了！ ​
一棵不知名的芒果树,3780578405,04月14日 22:59,Share微博客户端,,,3,,,-,跟朋友圈一位老师同感，当学生的课前演讲开始关注新疆棉和日本排放核废水这样的事，感动➕骄傲 ​
被狐狸追杀的兔子,6878675943,04月14日 22:59,华为畅享 10S,,,,1,,#赵立坚说请日本官员先喝核废水#,刚！！！ ​
小可乐爱鹿晗,6255313641,04月14日 14:13,牛博超话,,,1,4,,#核污水入海有多可怕# #日本核废水入海对中国有何影响# #日本副首相称喝处理核废水没事#,牛博核污水入海，其残留会造成人类DNA的变迁，引发甲状腺癌，白血病的上升，中国🇨🇳人的身体健康会受到严重的伤害！而日本副首相及一些政客称喝处理核废水没事，那就留着他们自己内部消化，慢慢饮用，不要让中国及全球的人来买单！   2成都·盐市口 收起全文d
呱唧呱唧小光霁,6201177411,04月14日 22:59,华为手机 畅享玩不停,,,,,,#任豪回应#, 真是迷惑，就这还有粉丝在洗，真不至于追个星脑子都不要了，立场都不要了，就无语任豪您要是智障乖乖搁那儿呆着就行了，别他妈一脸痴呆还在那里指手画脚，国家的决定可以质疑，可以议论，但不包括你这种脑子里掺了屎的人，实在太闲你可以去喝两口核废水，毕竟你也没啥价值 收起全文d
赵雁博666,5948653070,04月14日 22:59,荣耀8X,,,,,,-,『史无前例！一图看懂日本核废水排海危害』O史无前例！一图看懂日本核废水排海危害 ​
那天你的眼睛像星星,5342894353,04月14日 22:59,HUAWEI P30,,,6,9,,#核废水中放射性物质危害有多大#, 跪求全世界有钱人能把眼光放的长远一点 全世界一起帮日本的核废水处理好了 真的 别再在乎钱了 人没了 钱还在 日本因为处理不了这事儿 已经疯了 你们要是不帮他们我怕世界大战又得来了 日本人 是岛国 天天地震 安全感很差 整个民族的人就很多地方不太 希望你们可以帮他们解决掉 要是实在缺钱 全世界的人 一人捐一点也可以 这玩意太可怕了 我周围一同龄人得了甲状腺癌？？？？ 我搜了搜网上的言论 乱七八糟的一些东西 这核废水会影响人体 让人得乱七八糟的病 我？？？？我在山东沿海 真的就看完科普 有点儿睡不着觉了 收起全文d
我爱糖醋小排排排,3840832056,04月14日 22:59,iPhone 8 Plus,,,,2,,-,原来真的有人脑袋是这么神经的 建议任豪一天一杯核废水 ​
喝汤的三七,2106867090,04月14日 22:59,OnePlus 7 Pro,,,,6,,#任豪回应#,某小鲜肉，其实说这么多很难让大家理解，说一万句不如喝一杯核废水来的实在，而不是只出一张嘴就让政府用纳税人的钱，让中国人用生命去为发达国家的错误买单，凭什么呢？保护海洋只靠一张嘴吗？这和瑞典女有啥区别呀，真的环保的话就请在生活中做一些环保的事吧，环保不是只出一张嘴，这年头真的只要像个人都可以做偶像吗？ 收起全文d
朵朵兜里有糖,5797505061,04月14日 22:59,OnePlus 6,,,,6,@R1SE-任豪,#任豪回应##任豪回应#,任豪我发现你真的是个nt，道德绑架中国你可真有一套🙏 小日本的核废水为啥要让🇨🇳 去擦屁股，他那不要脸的美国爹还屁话都没放过一句，你在这扯什么能，外交部都没你一个所谓的偶像看得透？咋的用你教国家做事？以为自己还挺有文化？其实大字不识一个，长点心吧 球球了这种带坏小朋三观的人有一个封杀一个🙏🙏🙏🙏偶像这种真的要建门槛了，凭啥这种没有基本的三观的那男男女女赚的盆满钵满带坏未来祖国花朵长得帅果然不能当饭吃 都是什么牛马，孝到我了@R1SE-任豪 收起全文d
杨恒宇最帅,6871950641,04月14日 22:59,OPPO随光而变R17,,,,,,#任豪回应#,快喝核废水.保护地球不是动动嘴皮子就行的.带着你的900万粉丝一起喝光核废水，为地球做贡献吧. ​
中原渔夫,6407216569,04月14日 15:30,微博视频号,,,,,,#日本大叔讲核废水排海危害#】#日本大叔称稀释浓度是欺骗#,【海洋不仅仅是日本单独拥有的，而是都连接在一起。如果核废水污染公海的话，那就是全球的问题；日本政府所说的稀释没有任何意义，排放入海还会在海里稀释，（稀释浓度）是欺骗，和糊弄不懂核辐射的老百姓的说辞而已；“风评被害”是用来形容毫无根据的事情，核废水入海不是“风评被害”，而是“实际危害”。（人民日报国际） L人民网的微博视频 收起全文d
广西网络广播电视台GXNTV,5474560716,04月14日 22:59,微博 weibo.com,,,,,,-,【新闻1+1丨日本核废水入海，“核”试吗？合适吗？】13日，日本政府正式决定将福岛核废水排海。此举不仅引发日本国民的不满和质疑，中国、韩国等周边国家也都纷纷表示反对：这种做法极其不负责任，将严重损害国际公共健康安全和周边国家人民切身利益。日本为什么这么做？由此带来的影响是什么？核废水入海，真能“一倒了之”吗？ 日本核废水入海，“核”试吗？合适吗？O新闻1+1丨日本核废水入海，“核”试吗？合适吗？ 收起全文d
小秦一直很努力,6373579090,04月14日 22:59,小米浏览器,,,,,,-,"我分享了【史无前例！一图看懂日本核废水排海危害】, 快来看吧！ | O史无前例！一图看懂日本核废水排海危害 ​"
峰放送,1655897880,04月14日 22:59,头条新闻工作室超话,,,1,3,,#流浪地球#感动了，要中国帮日本用#更大的罩子#处理核废水】 #乒乓外交五十年# 后，有人想试试娱乐外交？#任豪这是在干什么##任豪回应#,头条新闻工作室 【任豪可能被 L一騳千囍的微博视频 ​​​
我要飞1115248563,1115248563,04月14日 09:50,微博视频号,,,,,,#V光计划#,【逸语道破：核废水入海危及全球，还有人给日本政府做“文宣”？】日本政府想省事，东电想省钱，但即便日本政府对国际原子能机构影响巨大，他们也根本没有为日本政府开通行证。我们国内的部分自媒体哪里来的自信给日本政府“开绿灯”？说日本核废水安全的“公关稿”请不要再发了。 L沈逸的微博视频 收起全文d
荒火予星河,6619272825,04月14日 17:19,微博视频号,,,,,,#赵立坚说请日本官员先喝核废水#】#日本副首相称喝处理核废水没事#,【，赵立坚：那请他喝了再说！ L央视新闻的微博视频 ​
xx天天都有好运气,6037287951,04月14日 18:54,小米CC9,,,,,,-,抱歉，此微博已被作者删除。查看帮助：O网页链接
大幂幂是我的梦中情人,6451568702,04月14日 22:59,荣耀X10 5G,,,,,,#王志文力挺任豪#,核废水这件事，中国要做的就是让日本这个脑残的国家把这个想法给吞回去，还帮忙研究，咋的，谁脑残谁有理啊，真绝了，日本这么有想法，你去当日本人好了，中国人智商太高，配不得你 ​
想养狗的花痴,6452855618,04月14日 22:59,微博 HTML5 版,,,,,,-,创造营的二鬼子粉丝，我看是核废水的第一波受众，还是主动要去喝的 ​
o红烧大堡礁o,2607643425,04月14日 16:45,新版微博 weibo.com,,,,,,-,印度杀疯了！干的太漂亮！ ​
远山有Q,3742329443,04月14日 22:59,iPhone客户端,,,,,,#任豪回应#,日本的核废水莫不是倒进了这位小哥的脑子里，明星关注国际社会问题是好事，但是拜托带上脑子再发言吧。还有更大的罩子是什么鬼？？ ​
暴躁敦敦,7358320183,04月14日 16:24,微博视频号,,,,,,#赵立坚说太平洋不是日本的下水道#,【】今天，外交部发言人赵立坚强调：“海洋不是日本的垃圾桶，太平洋也不是日本的下水道！日方处理核废水，不应让全世界买单。”至于日本个别官员称这些水喝了也没事，请他喝了再说。（总台央视记者申杨 张熙 杨毅） L环球资讯的微博视频 ​
·七号鱼物语·,7535078032,04月14日 18:49,iPhone客户端,,,,,,-,现在脱粉实时，一半是任豪粉丝正在脱粉，另一半是庆幸自己脱粉的早…… ​
瑞雪予春景,5896473647,04月14日 22:59,荣耀V20 4800万3D相机,,,,,,#王志文力挺任豪#,一个个没有白左的命，却得了白左的病。塞罕坝植树时没你，治沙时没你，哪怕捐点钱给蚂蚁森林也可以啊，偏偏鬼子排核废水时高喊“保护环境，人人有责”。爱国卫生七个专项行动做好吧，巴黎圣母院被烧了觉得自己就有做活圣母的资格是吧？ ​
东海菇凉,3608114130,04月14日 22:59,微博 weibo.com,,,,,,#如何看待日本福岛核废水排海#    方才杀人的是魔宫#杨幂英伦侦探风大片#,右护法千羽，样貌阴柔，一双桃花眼似笑非笑，让人辨不出他到底是男是女。 ​
夏语冰7,6427340027,04月14日 17:16,iPhone 12 Pro Max,,,,,,-,夭寿了，跟日本比印度都能找到环保的道德制高点了，鬼子这套操作保守估计被鞭尸二百年 ​
陶柯98771,6558291283,04月13日 19:47,微博视频号,,,2,,,#日本为何执意排核污入海#】4月13日，日本政府经阁僚会议决定将福岛第一核电站核污水排入大海。一直以来，日本官员宣称，核污水入海是唯一解决方案，事实上，日本政府和民间组织曾考虑过数项方案。最终，日本选择了“最简单粗暴”的方案处理核污水。在国内外反对声中，日本政府为何“一意孤行”在此时处理核污水？#洞见计划#,【 L世面的微博视频 收起全文d
努力奋斗快去学习,5992221009,04月14日 22:59,iPad客户端,,,,1,,#赵立坚说请日本官员先喝核废水#,！！好东西留给你们自己 ​
不会游泳的鱼tzt,7258932028,04月13日 12:04,盘子Android,,,,,,#日本政府正式决定福岛核废水排海#。对此，中国和韩国政府表示反对，但#美国支持日本福岛污水入海决定#,由于已经将核废水进行了科学过滤，认为不会对环境造成污染， 。同时，中国网友也展开了激烈讨论，对此，您怎么看？ 日本将处理过的核废水排海，您认为对还是不对？ ​
相信明天的世界会更好,6381237100,04月14日 21:02,微博视频号,,,,,,#又又切克闹#1丨史上最强“高仿号”！伪装成记者被白宫“翻牌”了】明星高仿骗赞什么的都弱爆了，美国一名网友伪装成记者，成功四次向白宫新闻发言人提问还被“翻牌”了？！真·白宫记者又又为你揭秘20号我还会到白宫值班，大家有什么想问白宫的问题可以留言给我哦~另外，新节目正式上线啦，大家多多期待哦 #V光计划#,【 L凤凰王又又的微博视频 收起全文d
疯水侠,2826512442,04月14日 22:59,iPhone客户端,,,,1,,#日本核废水入海对中国有何影响#,明日2021-04-15，癸巳日财神位：正南方与属猴六合，与属鸡强半三合，与属牛弱半三合，与属猴属虎相刑，与属虎相害，与属猪相冲，与属猴相破 ​
霖儿athena,2546966304,04月13日 08:42,微博视频号,,,,,,#日本核废水排海后海鲜能放心吃吗#？】4月13日，#日本政府正式决定福岛核废水排海#,【真这么干了！。当核废水顺着洋流走向全球，全世界渔业都会受到影响。虽然很多人认为洋流走向，中国海域受的影响很小，但是要知道，环太平洋是我国远洋渔船前往的主要渔场，最近五六年我国远洋渔获总量都维持在200万吨左右，几乎三分之二都是在环太平洋捕捞的。可见，整个太平洋的安全，与我国渔业息息相关。”那么，日本核废水排海后海鲜能放心吃吗？↓↓O日本正式决定：福岛核废水将排向大海 海鲜还能吃吗？ L中国三农发布的微博视频 收起全文d
蜉蝣命薄,3137642511,04月14日 20:47,微博视频号,,,,,,#多地渔民捞到境外间谍装置#】不久前，江苏盐城一位渔民捕鱼作业时，捕捞到一个不明装置。经鉴定，这是境外国家投放的窃密装置，性能先进，功能强大。2016年至今，江苏、浙江、海南等沿海地区捞获了一批境外装置！有些国家把深水探测器扔到我们家门口，这种小偷的窥视行为绝对不能允许！#国家安全教育日#,【 L央视新闻的微博视频 收起全文d
一位不知名的英俊网友,2182080671,04月14日 22:59,HUAWEI P10 Plus,,,,,@R1SE-任豪@王志文Kane,#美国禁止日本食品进入#,老双标了，全世界人民都懂，还有任豪和王志文这两只狗应该滚回他们祖国日本去喝核废水！@R1SE-任豪 @王志文Kane ​
天蝎座的seven,2729374951,04月14日 17:19,微博视频号,,,,,,#赵立坚说请日本官员先喝核废水#】#日本副首相称喝处理核废水没事#,【，赵立坚：那请他喝了再说！ L央视新闻的微博视频 ​
9Uuli,5514052788,04月14日 00:14,OPPO A32,,,,,,-,真正的童话故事，不是王子遇见了公主从此过上了幸福的生活，而是一个平庸的我，遇见了一个平庸的你，我们愿意放下幻想，放弃标准，做一对相互依偎的狗。因为此刻，我们只愿相互依偎，彼此忠诚。 ​
I-love-panda,2578181517,04月14日 22:59,HUAWEI P40 5G,,,,,,#王志文力挺任豪#,搞清楚问题没有，日本有能力自己解决问题，但是他们不想花钱解决问题。既然提到世界了那为啥只要求中国干啥呢。外务省钱不能白花啊，赶紧接过去喝核废水，毕竟喝了也检测不出来有问题，免得你们天天演怪累的。 ​
我爱吃苹果和你们,2885226427,04月14日 09:50,微博视频号,,,,,,#V光计划#,【逸语道破：核废水入海危及全球，还有人给日本政府做“文宣”？】日本政府想省事，东电想省钱，但即便日本政府对国际原子能机构影响巨大，他们也根本没有为日本政府开通行证。我们国内的部分自媒体哪里来的自信给日本政府“开绿灯”？说日本核废水安全的“公关稿”请不要再发了。 L沈逸的微博视频 收起全文d
Amaz1ngV,7013711013,04月14日 22:59,nova 5i Pro,,,,,,#更大的罩子#,日本核废水处理还得看我任豪太郎 ​
我很要得,6330893444,04月14日 21:43,OPPO A9,,,,,,-,抱歉，由于作者设置，你暂时没有这条微博的查看权限哦。查看帮助：http://t.cn/RfdBWwP ​
奇迹桃汁软糖,6059089083,04月14日 18:58,微博国际版,,,,,,-,任豪回应 真的疯了吧 ​
把花揉碎砸你脸,5892240329,04月14日 18:54,荣耀X10 5G,,,,,,-,抱歉，此微博已被作者删除。查看帮助：O网页链接
fcscx吖,6355689105,04月14日 21:56,iPhone X,,,,,,-,保护环境人人有责晚安 ​
English杠,7385356675,04月14日 22:59,OPPO R9,,,,1,,#任豪回应##王志文力挺任豪##更大的罩子##赵立坚说太平洋不是日本的下水道##日本核废水入海对中国有何影响##赵立坚说请日本官员先喝核废水##文在寅欲起诉日本核污水入海#, 这么多热搜？！这是在蹭国际新闻的热度吗？这两张图笑死我了 ​
感谢有个林夕8,3844589308,04月14日 22:59,VVebo,,,,2,,#日本政府正式决定福岛核废水排海#, 日本人表面如菊，内心如刀。狭小的地理环境促成了这一挣扎的民族性格。参考美国与日本的关系再结合菊与刀中本尼迪克特对日本民族性格的解剖，可以得出一个结论，就是日本这个国家必须给他打的服服的，让他彻底认识到中日实力差距，这样他才能忠。 ​
生在种花家的老张,1929617365,04月14日 22:59,哔哩哔哩,,,1,,@日本国驻华大使馆,#哔哩哔哩动画#,@日本国驻华大使馆   敢不敢直播“麻痹太郎”、“三陪小三”喝核废水？？赵立坚就核废水排海三问日本：喝了再说吧 O赵立坚就核废水排海三问日本：喝了再说吧 ​
白开水就好333,6078951875,04月14日 17:19,微博视频号,,,,,,#赵立坚说请日本官员先喝核废水#】#日本副首相称喝处理核废水没事#,【，赵立坚：那请他喝了再说！ L央视新闻的微博视频 ​
用户7514311119,7514311119,04月14日 22:59,OPPO Reno5 K 5G,,,,,,#赵立坚说请日本官员先喝核废水#,喝了再说吧 ​
陈小天xt,6033138409,04月14日 22:59,HUAWEI P30 Pro,,,,4,,#赵立坚说请日本官员先喝核废水#,扇贝单词，爱了！ ​
长乐宫扛把子,3799798868,04月13日 19:25,微博 weibo.com,,,,,,#多方表态反对日本核废水入海#】日本政府正式决定向海洋排放福岛第一核电站核废水。绿色和平组织核专家提醒，日核废水所含碳14在数千年内都存在危险，并可能造成基因损害。核废水处置问题事关国际海洋环境、食品安全和人类健康，各方严重关切↓↓#专家提醒日核废水可能造成基因损害#,【反对一倒了之！ ​
WaterVapor,2915229350,04月14日 22:17,vivo AI智慧拍照X21i,,,,,,#王志文力挺任豪#,老天啊 为什么没有个巨大的罩子罩住这些娱乐圈的智障 然后打包一起送去日本治理核废水 就你们有大局观 无语 ​
昭羽昭羽,5323765774,04月14日 16:45,OPPO R9,,,,,,-,印度杀疯了！干的太漂亮！ ​
罗云熙是透哥哥呀,6333571933,04月14日 22:59,vivo Y73s 5G,,,,1,,#日本副首相称喝处理核废水没事#,？？？请他喝了再说 ​
Macronnva,5476080034,04月14日 22:58,vivo智能手机,,,,,,-,美国和日本这种国家是不是根本就没有人类命运共同体的概念 我感觉日本把核污染的废水倒进太平洋之后地球就毁了 我甚至感觉现在学习都没什么用了，反正的以后的世界是与我无关了 ​
乐呵2222222,5925442404,04月14日 22:58,华为手机 畅享玩不停,,,,,,#日本大叔讲核废水排海危害#,老大叔你在日不明的地方活的明白啊！ 2广州·京溪 ​
蹦擦拉卡拉,5873856006,04月14日 22:58,iPad mini,,,,,,#王志文力挺任豪#,所以日本核废水问题到底怎么办？眼睁睁看着日本往太平洋倒废水，然后把全球糟蹋了吗？？怎么才能让日本解决啊？？？？？？？？有人告诉我吗 ​
畅言310,6518623369,04月14日 22:58,vivo S1 Pro 升降自拍,,,,,,#脱粉#,“Rapper”的理想主义？可是你这次真的是出界了——没有科学意识+国家观念你应该痛定思痛，去当个科学家，核废水的处理就靠你了 ​
屋外老二_,5573840952,04月14日 22:58,微博 weibo.com,,1,,5,,#日本核废水入海对中国有何影响# #日本政府正式决定福岛核废水排海#,笑死，在让人失望这件事上日本政府从没让人失望。 ​
LadyGaga中文论坛,7256784674,04月14日 22:58,iPhone 8,,1,2,9,,#ladygaga偷喝核废水不幸发生变异#, ​
王俊凯要健康平安喜乐k,5652907366,04月14日 17:19,微博视频号,,,,,,#赵立坚说请日本官员先喝核废水#】#日本副首相称喝处理核废水没事#,【，赵立坚：那请他喝了再说！ L央视新闻的微博视频 ​
木小语o_oV,2557054903,04月14日 09:50,微博视频号,,,,,,#V光计划#,【逸语道破：核废水入海危及全球，还有人给日本政府做“文宣”？】日本政府想省事，东电想省钱，但即便日本政府对国际原子能机构影响巨大，他们也根本没有为日本政府开通行证。我们国内的部分自媒体哪里来的自信给日本政府“开绿灯”？说日本核废水安全的“公关稿”请不要再发了。 L沈逸的微博视频 收起全文d
平平无奇的宝妈爱追剧,7427990799,04月14日 22:58,荣耀8X,,,,,,-,最近日本排放核废水的事闹得人心惶惶，真不知道这些人脑子是不是被核辐射搞坏掉了，还是真存了些不可告人的坏心思呢！多少人的生命健康问题啊，日本赶紧从世界地图上消失吧。over！ ​
菜鸟军虫,1393202693,04月14日 22:58,菜鸟军虫超话,,1,,,@央视网视频,#日本核废水入海对中国有何影响#,菜鸟军虫关注。【专家：美国只要日本“听话”对抗中国 不在意它排放核污水】对于日本政府将福岛核污水排入大海的决定，美国国务卿布林肯发文以示支持，称“我们感谢日方在决定处理核电站废水问题上显示出来的透明度”。专家表示，美方表态既天真又无知，体现出实用主义哲学为上的外交选择。 @央视网视频 L菜鸟军虫的微博视频 收起全文d
氵殳有ID,5523520634,04月14日 22:58,荣耀 9X PRO,,,,,,#任豪回应#,孝死了孝死了下届日本首相选举没任豪我第一个不服和给你洗白的狗粉们快去舔你日本爹爹真会道德绑架 那就快去喝核废水吧 ​
福冈星矢,6643954537,04月14日 17:19,微博视频号,,,,,,#赵立坚说请日本官员先喝核废水#】#日本副首相称喝处理核废水没事#,【，赵立坚：那请他喝了再说！ L央视新闻的微博视频 ​
圆圆山山快出来,7006314056,04月14日 22:01,微博 weibo.com,,,,,,#王志文力挺任豪#,前营人王志文力挺任豪，还表示是出于好意的话语，之后又删掉了微博 ​
伊吹可以把我吹秃,5945753147,04月14日 22:58,Android,,,,2,,#任豪回应#,我直接笑傻快去和日本官员一起喝核废水吧我还可以给你捐18斤菠萝打汁喝 ​
橙茶Macchiato,2230057800,04月14日 18:49,荣耀V10 我AI的快,,,,,,-,现在脱粉实时，一半是任豪粉丝正在脱粉，另一半是庆幸自己脱粉的早…… ​
西部牛人兰博Dee,2092512240,04月14日 22:58,nova6 5G自拍大不一样,,,,,,-,朋友转过来两个链接，其中一篇文章说，希望自己这种“爱国者”能多关心自己家和工作的事，意思是少管日本向海洋排核废水的闲事。另外一篇文章大骂我们这些人“不要脸”，理由也是“身边人事不关心，却管日本核污染”。哈哈，中国林子大，鸟的种类自然多。但我就纳闷了，美日那么关心新疆的事，那可真是跟他们八竿子打不着的纯粹中国的事，咋就是正常的；而日本向太平洋排核废水，它们最终可能流到中国近海，中国人与这件事的关联可比美日与新疆事务的关联大了不知多少倍，老胡等拍案怒斥日本政府不负责任，咋就不正常了呢？ 这种声音反映了有一部分国人心中有着根深蒂固的对“西洋”乃至“东洋”的奴性，这是我们民族一度积贫积弱并且受到外部奴役欺凌坐下的病根。要消除它得慢慢养，太急了没用。 在精神上站起来，对外想怎么表达就怎么表达，别什么都对照西方的样子，他们的价值观首先是他们利益的产物。我们捍卫自己的利益同样天经地义，不丢人。日本人往海洋里排核废水，这种缺德事就是要骂，能阻止要阻止，阻止不了也要让他们欠下一笔道德帐。看看他们就这件事是怎样请示遥远的美国的，又是如何对待身边的中韩俄的，还有中国人要给这样干的日本洗地吗？太贱了吧 收起全文d
嘉_Jarnival,6766365299,04月14日 22:58,Redmi K40 Pro,,,,,,#赵立坚说请日本官员先喝核废水#,世界上居然有这么魔幻的事情 一个国家做这么不负责的事儿？日本官员脑子里是废水吗？是想和全人类一起灭绝吗？ ​
RUI柚子和橙子,6531687395,04月14日 22:58,Android,,,,,,#赵立坚说请日本官员先喝核废水#, ​
顾思君,1944486167,04月14日 18:54,微博国际版,,,,,,-,抱歉，此微博已被作者删除。查看帮助：O网页链接
小徐今天更好了吗_,3926509057,04月14日 22:58,nova7你在焦点在,,,1,,@R1SE-任豪@王志文Kane,#任豪回应##日本大叔讲核废水排海危害#,@R1SE-任豪 @王志文Kane 来，给大叔讲讲你们的计划 ​
韭黄-韩潮,6164845823,04月14日 22:58,Samsung Z Fold2 5G,,,4,3,,#赵立坚说请日本官员先喝核废水#,日本官员应该多喝核能废水，多吃核能海鲜刺身，多泡核能温泉。争取人人都是哥斯拉，到时候能吹一波奥特曼了 ​
